100265002,Semilla Artibruja,"Si esta carta es Invocada de Modo Normal o Especial y controlas un monstruo ""Artibruja"" que no sea ""Semilla Artibruja"", o ""Regulus, el Príncipe de Endimión"": puedes seleccionar 1 carta boca arriba en el Campo; devuélvela a la mano. 
Puedes desterrar esta carta en tu Cementerio; revela cualquier número de cartas en tu mano, incluyendo una Mágica, y barájalas al Deck, y después roba esa misma cantidad de cartas. 
Sólo puedes usar cada uno de los efectos de ""Semilla Artibruja"" una vez por turno.",Devolver a la mano,Robar,,,,,,,,,,,,,,
101306001,Guerrero Pantera Veloz,"Sólo puedes usar el siguiente efecto de ""Guerrero Pantera Veloz"" una vez por turno. 
(Efecto Rápido): Durante la Main Phase, puedes Sacrificar otro monstruo en tu mano o Campo y aplicar uno de los siguientes efectos:
● Invoca de Modo Especial 1 monstruo que mencione ""Mago del Tiempo Oscuro"", excepto ""Guerrero Pantera Veloz"", desde tu mano o Deck.
● Manda al Cementerio 1 Carta Mágica/Trampa que mencione ""Mago del Tiempo Oscuro"" desde tu Deck.	
Esta carta no puede declarar un ataque a menos que un monstruo haya sido Sacrificado este turno.",Activar el efecto,,Invocación Especial,Enviar al Cementerio,,,,,,,,,,,,
101306002,"Aligátor de la Espada, el Caballero Dragón","Esta carta puede atacar directamente. 
Sólo puedes usar cada uno de los siguientes efectos de ""Aligátor de la Espada, el Caballero Dragón"" una vez por turno. 
Mientras esta carta está en tu mano, puedes revelar otra carta en tu mano que mencione ""Mago del Tiempo Oscuro""; Invoca esta carta de Modo Especial. 
Si esta carta es Invocada de Modo Normal o Especial: puedes añadir a tu mano 2 Cartas Mágicas/Trampa que mencionen ""Mago del Tiempo Oscuro"", y después descartar 1 carta.",Invocación Especial,Añadir a la mano,,,,,,,,,,,,,,
101306003,Jinzo - Impactador Psicoenergético,"Esta carta también se trata como ""Jinzo"" mientras está en el Campo o en el Cementerio. 
Si esta carta es Invocada de Modo Normal o Especial: puedes destruir todas las Cartas Trampa que controle tu adversario (revela y confirma las cartas Colocadas) y después aumenta el ATK de esta carta en 300 x el número de cartas destruidas por este efecto. 
Sólo puedes usar este efecto de ""Jinzo - Impactador Psicoenergético"" una vez por turno. 
Mientras controles otro monstruo que mencione ""Mago del Tiempo Oscuro"", tu adversario no puede activar los efectos de Cartas Trampa.",Destruir,,,,,,,,,,,,,,,
101306004,"El Pescador, la Leyenda del Gran Mar","Si tu adversario activa un efecto de monstruo en el Campo, o cuando un monstruo del adversario declara un ataque, mientras hay una carta que mencione ""Mago del Tiempo Oscuro"" (excepto ""El Pescador, la Leyenda del Gran Mar"") o ""Umi"" en el Campo: puedes Invocar esta carta de Modo Especial desde tu mano. 
Si esta carta es Invocada de Modo Especial: puedes seleccionar 1 monstruo que controle tu adversario; destrúyelo, y además devuelve esta carta a la mano durante la End Phase de este turno. 
Sólo puedes usar cada uno de los efectos de ""El Pescador, la Leyenda del Gran Mar"" una vez por turno.",Invocación Especial,Destruir,,,,,,,,,,,,,,
101306009,金神之战鬼 赤砂,"这个卡名的①的方法的特殊召唤1回合只能有1次，②③的效果1回合各能使用1次。
①：这张卡可以让自己场上1张里侧表示卡给对方确认回到手卡·额外卡组，从手卡特殊召唤。
②：自己·对方的主要阶段，从自己的手卡·场上（里侧表示）把1张陷阱卡送去墓地才能发动。对方场上的表侧表示怪兽全部变成里侧守备表示。
③：自己结束阶段才能发动。从卡组把1张「艮鬼」陷阱卡在自己场上盖放。",,Cambiar a posición boca abajo,Colocar,,,,,,,,,,,,,
101306010,蛊神之色鬼 葛叶,"这个卡名的①的方法的特殊召唤1回合只能有1次，②③的效果1回合各能使用1次。
①：这张卡可以让自己场上1张里侧表示卡给对方确认回到手卡·额外卡组，从手卡特殊召唤。
②：场上的里侧表示卡每有2张则最多1张，以场上的卡为对象才能发动。那些卡破坏。
③：自己结束阶段，以自己墓地的1张「艮鬼」陷阱卡为对象才能发动。那张卡在自己场上盖放。",,Destruir,Colocar,,,,,,,,,,,,,
101306011,疫神之依鬼 丰吾,"这个卡名的①的方法的特殊召唤1回合只能有1次，②③的效果1回合各能使用1次。
①：这张卡可以让自己场上1张里侧表示卡给对方出示回到手卡·额外卡组，从手卡特殊召唤。
②：自己主要阶段才能发动。从卡组把1张「艮鬼」魔法·陷阱卡在自己场上盖放。
③：对方回合，以场上1只表侧表示怪兽为对象才能发动。那只怪兽的等级上升或下降1。",,Colocar,Cambiar Nivel,Aumentar Nivel,Disminuir Nivel,,,,,,,,,,,
101306012,封神之剑鬼 水分,"这个卡名的①的方法的特殊召唤1回合只能有1次，②③的效果1回合各能使用1次。
①：这张卡可以让自己场上1张里侧表示卡给对方出示回到手卡·额外卡组，从手卡特殊召唤。
②：自己主要阶段才能发动。从卡组把幻龙族以外的1只「艮鬼」怪兽加入手卡。
③：这张卡作为「艮鬼」同调怪兽的同调素材被送去墓地的场合，以自己墓地1张通常陷阱卡为对象才能发动。那张卡在自己场上盖放。",,Añadir a la mano,Colocar,,,,,,,,,,,,,
101306013,Señor Dragón de Atlantis - Dédalo,"(El nombre de esta carta se convierte en ""Umi"" mientras esté en la Zona de Monstruos).	
Si controlas ""Atlantis, la Ciudad Dragón"" o ""Umi"": puedes Invocar esta carta de Modo Especial desde tu mano. 
Puedes mandar al Cementerio hasta 3 ""Umi"" boca arriba que controles; añade a tu mano la misma cantidad de cartas que mencionen ""Atlantis, la Ciudad Dragón"" desde tu Deck, excepto monstruos de Nivel 7, y después puedes mandar al Cementerio 1 carta en el Campo. 
Sólo puedes usar cada uno de los efectos de ""Señor Dragón de Atlantis - Dédalo"" una vez por turno.",Invocación Especial,Efecto de añadir a la mano,¿Enviar la carta seleccionada al Cementerio?,,,,,,,,,,,,,
101306014,General de Atlantis,"(El nombre de esta carta se convierte en ""Umi"" mientras esté en la Zona de Monstruos).	
Puedes descartar esta carta; añade a tu mano 1 Mágica/Trampa que mencione ""Atlantis, la Ciudad Dragón"" desde tu Deck. 
Si esta carta está en tu Cementerio y controlas ""Umi"": puedes Invocar esta carta de Modo Especial. 
Sólo puedes usar cada uno de los efectos de ""General de Atlantis"" una vez por turno.",Efecto de añadir a la mano,Invocación Especial,,,,,,,,,,,,,,
101306015,Brazos Monstruosos de Atlantis,"(El nombre de esta carta se convierte en ""Umi"" mientras esté en la Zona de Monstruos).	
Si esta carta es Invocada de Modo Normal o Especial: puedes seleccionar 1 monstruo en tu Cementerio que mencione ""Atlantis, la Ciudad Dragón""; Invócalo de Modo Especial en Posición de Defensa. 
(Efecto Rápido): Cuando tu adversario activa un efecto de monstruo: puedes desterrar esta carta en tu Campo o Cementerio y mandar al Cementerio 1 ""Umi"" boca arriba que controles; niega ese efecto. 
Sólo puedes usar cada uno de los efectos de ""Brazos Monstruosos de Atlantis"" una vez por turno.",Invocación Especial,Negar el efecto,,,,,,,,,,,,,,
101306016,Vórtice Maligno de Atlantis,"(El nombre de esta carta se convierte en ""Umi"" mientras esté en la Zona de Monstruos).	
Si esta carta es Invocada de Modo Normal o Especial: puedes mandar al Cementerio 1 carta que mencione ""Atlantis, la Ciudad Dragón"" desde tu Deck, excepto ""Vórtice Maligno de Atlantis"". 
Si esta carta es mandada al Cementerio y controlas ""Umi"": puedes Invocar de Modo Especial 1 monstruo de AGUA desde tu mano. 
Sólo puedes usar cada uno de los efectos de ""Vórtice Maligno de Atlantis"" una vez por turno.",Enviar al Cementerio,Invocación Especial,,,,,,,,,,,,,,
101306021,HÉROE del Destino – Death Dogma,"No puede ser Invocado de Modo Normal/Colocado. Debe ser Invocado de Modo Especial (desde tu mano o Cementerio) desterrando 3 monstruos Guerrero y/o de OSCURIDAD en tu Cementerio. 
Sólo puedes Invocar de Modo Especial ""HÉROE del Destino – Death Dogma"" una vez por turno de esta forma. 
Si es Invocado de esta forma: puedes activar este efecto; inflige 2000 puntos de daño a tu adversario durante la próxima Standby Phase. 
Una vez por turno, cuando tu adversario activa una carta o efecto (Efecto Rápido): puedes Invocar por Fusión 1 monstruo de OSCURIDAD o Guerrero desde tu Deck Extra, barajando al Deck sus materiales desde tu mano, Campo y/o Cementerio.",,Infligir daño,Invocación por Fusión,,,,,,,,,,,,,
101306022,HÉROE del Destino – Doom Liege,"Si esta carta es Invocada de Modo Normal o Especial: puedes seleccionar 1 monstruo que controle tu adversario; destiérralo hasta la próxima Standby Phase. 
Puedes mandar al Cementerio 1 monstruo ""HÉROE del Destino"" desde tu Deck; añade a tu mano 1 ""Prisión de la Torre del Reloj"" o ""Ciudad Prisión de la Torre del Reloj – Ciudad Oscura"" desde tu Deck o Cementerio. No puedes Invocar de Modo Especial por el resto de este turno, excepto monstruos ""HÉROE"" de OSCURIDAD. 
Sólo puedes usar cada uno de los efectos de ""HÉROE del Destino – Doom Liege"" una vez por turno.",Desterrar,Añadir a la mano,Desterrar hasta la próxima Standby Phase,,,,,,,,,,,,,
101306023,HÉROE del Destino – Dreadnought Servant,"Si controlas un monstruo ""HÉROE del Destino"" o una Mágica de Campo boca arriba: puedes Invocar esta carta de Modo Especial desde tu mano, y después puedes destruir 1 carta que controles y, si lo haces, añade a tu mano 1 ""Polimerización"" desde tu Deck. 
Si Invocas de Modo Especial uno o más monstruos ""HÉROE del Destino"" de Nivel 8: puedes desterrar esta carta en tu Cementerio, y después seleccionar 1 carta que controle tu adversario; ponla en la parte superior del Deck. 
Sólo puedes usar cada uno de los efectos de ""HÉROE del Destino – Dreadnought Servant"" una vez por turno.",Invocación Especial,Devolver al Deck,¿Destruir y añadir a la mano?,,,,,,,,,,,,,
101306024,Contactador Adamancipador,"Si esta carta está en tu mano: puedes colocar otra carta ""Adamancipador"" de tu mano en la parte superior del Deck; Invoca esta carta de Modo Especial. 
Durante tu Main Phase: puedes excavar las 5 cartas de la parte superior de tu Deck y, si lo haces, puedes Invocar de Modo Especial 1 monstruo Roca excavado de Nivel 4 o menor, y además coloca el resto en el fondo del Deck en cualquier orden. 
Sólo puedes usar cada uno de los efectos de ""Contactador Adamancipador"" una vez por turno.",Invocación Especial,Excavar el Deck,¿Invocar de Modo Especial el monstruo ?,,,,,,,,,,,,,
101306025,Cristal Adamancipador - Tiamita,"Si esta carta es Invocada de Modo Especial por el efecto de una carta ""Adamancipador"": puedes añadir a tu mano 1 carta ""Adamancipador"" desde tu Deck, excepto ""Cristal Adamancipador - Tiamita"", y después puedes Invocar de Modo Especial 1 monstruo de Tipo Roca desde tu mano. 
Si esta carta está en el Cementerio, puedes seleccionar 1 Monstruo de Sincronía que controles o en tu Cementerio; devuélvelo al Deck Extra y esta carta a la parte superior de tu Deck. 
Sólo puedes usar cada efecto de ""Cristal Adamancipador - Tiamita"" una vez por turno.
",Efecto de añadir a la mano,Devolver al Deck,Invocación Especial?,,,,,,,,,,,,,
101306036,Dragón Negro de Ojos Rojos Exceso,"""Dragón Negro de Ojos Rojos"" + 1 monstruo que mencione ""Mago del Tiempo Oscuro""	
Debe ser Invocado por Fusión, o Invocado de Modo Especial (desde el Deck Extra) Sacrificando 1 monstruo boca arriba de cualquier Campo el turno que destruiste un monstruo con el efecto de ""Mago del Tiempo Oscuro"". 
Si esta carta es Invocada de Modo Especial: puedes Invocar de Modo Especial 1 monstruo de Nivel 8 o menor desde tu mano o Cementerio. 
No es afectada por efectos de Mágicas y monstruos activados de tu adversario.",Invocación Especial,,,,,,,,,,,,,,,
101306037,HÉROE del Destino – Dreadnought,"2 monstruos ""HÉROE del Destino"" de Nivel 5 o mayor	
Debe ser Invocado por Fusión, o Invocado de Modo Especial (desde tu Deck Extra) Sacrificando 1 ""HÉROE del Destino - Dreadmaster"". 
Sólo puedes Invocar de Modo Especial ""HÉROE del Destino – Dreadnought"" una vez por turno de esta forma, sin importar el método que uses. 
Si esta carta es Invocada de Modo Especial: puedes añadir a tu mano 2 monstruos ""HÉROE del Destino"" y/o cartas que mencionen el nombre de un monstruo ""HÉROE del Destino"" desde tu Deck. 
El ATK de esta carta se convierte en el ATK original total de todos los demás monstruos ""HÉROE del Destino"" en tu Campo y Cementerio.",Añadir a la mano,,,,,,,,,,,,,,,
101306039,鬼神 朱沙之王,"调整＋调整以外的怪兽1只以上
这个卡名的①②的效果1回合各能使用1次。
①：这张卡同调召唤的场合，从自己墓地把陷阱卡任意数量除外才能发动。以那个数量把场上的卡除外。
②：自己·对方的结束阶段，以自己墓地·除外状态的「艮鬼」怪兽·陷阱卡最多2张为对象才能发动。那些卡各自加入手卡或在自己场上盖放。以2张卡为对象来发动的场合，再让这张卡回到额外卡组。",Destruir,Recuperar,,,,,,,,,,,,,,
101306040,鬼神 水子守命,"调整＋调整以外的怪兽1只以上
这个卡名的①的效果1回合只能使用1次。
①：这张卡特殊召唤的场合才能发动。从卡组把1张「艮鬼」卡送去墓地，场上1张卡送去墓地。
②：对方把怪兽的效果发动的场合，以自己墓地·除外状态的1张「艮鬼」陷阱卡为对象才能发动（场上的里侧表示卡是3张以上的场合，可以作为代替以自己墓地1张陷阱卡为对象）。那张卡在自己场上盖放。",Enviar al Cementerio,Colocar,,,,,,,,,,,,,,
101306041,Ascendente Adamancipador - Tiamita,"1 Cantante + 1+ monstruos que no sean Cantantes	
Si hay un monstruo de OSCURIDAD en tu Cementerio: puedes añadir a tu mano 1 Mágica/Trampa ""Adamancipador"" desde tu Deck. 
(Efecto Rápido): Cuando tu adversario activa un efecto de monstruo en el Campo: puedes excavar 5 cartas de la parte superior de tu Deck, puedes devolver a la mano monstruos que controle tu adversario hasta el número de monstruos Roca excavados, y además después de eso, coloca las cartas excavadas en el fondo del Deck en cualquier orden. 
Sólo puedes usar cada uno de los efectos de ""Ascendente Adamancipador - Tiamita"" una vez por turno.",Efecto de añadir a la mano,Devolver a la mano,¿Devolver una carta a la mano?,,,,,,,,,,,,,
101306045,"Swickelavee, la Caballería Pesada Brillantemente Coronada","2 monstruos de Nivel 3	
Una vez por turno, también puedes Invocar Xyz a ""Swickelavee, la Caballería Pesada Brillantemente Coronada"" usando 1 monstruo Bestia que controles con 2000 ATK o menos (transfiere sus materiales). 
No puede ser usado como material para una Invocación Xyz. 
Si esta carta destruye un monstruo en batalla: pon 1 Contador de Corona en ella, y después aplica este efecto basado en el número de Contadores de Corona que tenga;
● 1: Esta carta gana 400 ATK.
● 2: Esta carta gana 600 ATK.
● 3: Devuelve esta carta al Deck Extra y, si lo haces, roba 3 cartas.",¿Invocar Xyz usando un monstruo Bestia como material?,Colocar un contador,,,,,,,,,,,,,,
101306046,Señor Dragón del Océano Azul - Némesis de Neo-Dédalo,"4 monstruos	
(El nombre de esta carta se convierte en ""Umi"" mientras esté en la Zona de Monstruos).	
Si esta carta es Invocada por Enlace: puedes Invocar de Modo Especial hasta 3 monstruos que mencionen ""Atlantis, la Ciudad Dragón"" desde tu Cementerio a zonas a las que apunte esta carta, y además no puedes Invocar de Modo Especial por el resto de este turno. 
Una vez por turno (Efecto Rápido): puedes mandar al Cementerio 1 ""Umi"" boca arriba que controles; manda al Cementerio todas las cartas en el Campo, excepto ""Umi"".",Aplicar como Link-3 para una Invocación por Enlace ({CARD}),Invocación Especial,Enviar al Cementerio,,,,,,,,,,,,,
101306047,Levia-Dragoon - Dédalo,"3 monstruos de AGUA	
(El nombre de esta carta se convierte en ""Umi"" mientras esté en la Zona de Monstruos).	
Si esta carta es Invocada por Enlace: puedes Invocar de Modo Especial 1 monstruo que mencione ""Atlantis, la Ciudad Dragón"" desde tu Deck. 
(Efecto Rápido): Durante la Main Phase: puedes mandar al Cementerio 1 ""Umi"" boca arriba que controles; tu adversario descarta toda su mano y, si lo hace, roba la misma cantidad de cartas. Ningún jugador puede activar cartas o efectos en respuesta a la activación de este efecto. 
Sólo puedes usar cada uno de los efectos de ""Levia-Dragoon - Dédalo"" una vez por turno.",Aplicar como Link-2 para una Invocación por Enlace ({CARD}),Invocación Especial,Tu adversario descarta y roba,,,,,,,,,,,,,
101306049,Luminoso Adamancipador,"2 Monstruos de Efecto, incluyendo 1 Monstruo de Sincronía	
Si esta carta es Invocada por Enlace, o un monstruo es Invocado de Modo Especial a una zona a la que apunte esta carta: puedes seleccionar 1 monstruo en tu Campo o Cementerio; Invoca de Modo Especial 1 ""Ficha Milagro"" (Roca/LUZ/ATK 0/DEF 0) con el mismo Nivel que ese monstruo. 
(Efecto Rápido): Cuando se activa otro efecto de monstruo en el Campo: puedes colocar ese monstruo en el fondo del Deck. 
Sólo puedes usar cada uno de los efectos de ""Luminoso Adamancipador"" una vez por turno.",Invocación Especial,Devolver al Deck,,,,,,,,,,,,,,
101306052,Mago del Tiempo Oscuro,"Activa 1 de estos efectos (pero sólo puedes activar cada efecto de ""Mago del Tiempo Oscuro"" una vez por turno);
● Añade a tu mano 1 carta que mencione ""Mago del Tiempo Oscuro"" desde tu Deck, excepto ""Mago del Tiempo Oscuro"", y además durante esta End Phase, añade a tu mano 1 carta en tu Cementerio que mencione ""Mago del Tiempo Oscuro"".
● Lanza una moneda y adivina cara o cruz. Si aciertas, destruye todos los monstruos que controle tu adversario y, si lo haces, inflige daño a tu adversario igual a la mitad de su ATK combinado. Si fallas, destruye todos los monstruos que controles.",Activar,Añadir a la mano,Lanzar una moneda,,,,,,,,,,,,,
101306053,Dados Grácil y del Cráneo,"Lanza un dado de seis caras dos veces y además aplica estos efectos este turno. 
● Tus monstruos que mencionen ""Mago del Tiempo Oscuro"" ganan ATK/DEF igual al resultado x 200.
● Los monstruos de tu adversario pierden ATK/DEF igual al resultado x 200.	
Si tu adversario Invoca de Modo Normal o Especial uno o más monstruos, mientras esta carta está en el Cementerio: puedes desterrar esta carta, y después seleccionar 1 de esos monstruos; lanza un dado de seis caras dos veces, y si el resultado total es 6 o mayor, destruye ese monstruo.",Activar,Tirar un dado,,,,,,,,,,,,,,
101306054,Scapegoats Soñolientas,"Invoca de Modo Especial 4 ""Ficha de Cordero de Sacrificio"" (Bestia/TIERRA/Nivel 1/ATK 0/DEF 0), y después si tu adversario controla un monstruo, puedes Invocar de Modo Especial 1 ""Guerrero Pantera Veloz"" desde tu Deck. Por el resto de este turno, esas Fichas no pueden ser Sacrificadas para una Invocación por Sacrificio, y además no puedes Invocar de Modo Especial desde el Deck Extra, excepto Monstruos de Fusión. 
Si una o más cartas que controlas que mencionen ""Mago del Tiempo Oscuro"" fueran a ser destruidas en batalla o por efecto de carta, puedes destruir 1 de esas Fichas que controles en su lugar.",Activar,Selecciona el número de Invocaciones Especiales,¿Invocar de Modo Especial {CARD}?,,,,,,,,,,,,,
101306057,艮神鬼门 三千世界,"这个卡名的①②的效果1回合各能使用1次。
①：以自己场上的里侧表示卡任意数量为对象才能发动。从卡组把那些里侧表示卡数量的，场地魔法卡以外的「艮鬼」卡加入手卡（同名卡最多1张）。那之后，作为对象的里侧表示卡送去墓地。
②：自己场上有「艮鬼」怪兽以及里侧表示卡存在的状态，场上有卡盖放的场合，以场上1张卡为对象才能发动。那张卡回到手卡。",Añadir a la mano,Devolver a la mano,,,,,,,,,,,,,,
101306058,"Atlantis, la Ciudad Dragón","Los Niveles de todos los monstruos en las manos y los Campos de ambos jugadores se reducen en 1 mientras controlas un monstruo que mencione ""Atlantis, la Ciudad Dragón"". 
Puedes Invocar por Enlace monstruos ""Dédalo"" con 1 material menos. Reduce en 1 el número de materiales listados para la Invocación por Enlace de todos los monstruos ""Dédalo"". 
Si esta carta está en tu Cementerio y controlas ""Umi"": puedes Colocar esta carta boca arriba en tu Campo. 
Sólo puedes usar este efecto de ""Atlantis, la Ciudad Dragón"" una vez por turno.",,Colocar,,,,,,,,,,,,,,
101306059,Llamada de Atlantis,"Añade a tu mano 1 monstruo que mencione ""Atlantis, la Ciudad Dragón"" desde tu Deck, y después si controlas ""Atlantis, la Ciudad Dragón"", puedes negar los efectos de 1 Monstruo de Efecto que controle tu adversario hasta el final de este turno. 
Si controlas ""Umi"": puedes desterrar esta carta en tu Cementerio; todos los monstruos de AGUA que controles en este momento ganan 500 ATK/DEF. 
Sólo puedes usar cada uno de los efectos de ""Llamada de Atlantis"" una vez por turno.",Efecto de añadir a la mano,Aumentar ATK/DEF,¿Negar un monstruo?,,,,,,,,,,,,,
101306060,Aventura de Atlantis,"(El nombre de esta carta se convierte en ""Umi"" mientras esté en el Campo).	
Durante tu Main Phase: puedes Colocar 1 ""Atlantis, la Ciudad Dragón"" o ""Umi"" desde tu Deck boca arriba en tu Zona del Campo. 
Si esta carta es mandada al Cementerio: puedes añadir a tu mano 1 monstruo Serpiente Marina de Nivel 7 desde tu Deck. 
Sólo puedes usar cada uno de los efectos de ""Aventura de Atlantis"" una vez por turno.",Efecto de colocación,Efecto de añadir a la mano,,,,,,,,,,,,,,
101306062,Ciudad Prisión de la Torre del Reloj – Ciudad Oscura,"Cada vez que Invocas de Modo Especial uno o más monstruos ""HÉROE del Destino"" de Nivel 8 o mayor: todos los monstruos Guerrero que controles en este momento ganan 300 ATK. 
Sólo puedes usar cada uno de los siguientes efectos de ""Ciudad Prisión de la Torre del Reloj – Ciudad Oscura"" una vez por turno. 
Si esta carta fue activada este turno: puedes añadir a tu mano 1 monstruo ""HÉROE del Destino"", o 1 carta que mencione el nombre de un monstruo ""HÉROE del Destino"", desde tu Deck. 
Si esta carta es destruida: puedes Invocar de Modo Especial 1 monstruo ""HÉROE del Destino"" desde tu Deck (esto se trata como una Invocación Especial con ""Prisión de la Torre del Reloj"").",Añadir a la mano,Aumentar ATK,Invocación Especial,,,,,,,,,,,,,
101306063,Compañero Adamancipador,"Añade a tu mano 1 monstruo ""Adamancipador"" desde tu Deck. 
Si esta carta está en tu Cementerio: puedes colocar 1 carta de tu mano en la parte superior del Deck; añade esta carta a tu mano. 
Sólo puedes usar cada uno de los efectos de ""Compañero Adamancipador"" una vez por turno.",Efecto de añadir a la mano,Devolver a la mano,,,,,,,,,,,,,,
101306070,Ladrón de Tumbas Insensato,"Manda al Cementerio 1 carta que mencione ""Mago del Tiempo Oscuro"" (excepto ""Ladrón de Tumbas Insensato"") desde tu Deck, y después puedes Invocar de Modo Especial 1 monstruo de cualquier Cementerio a tu Campo. 
Puedes desterrar esta carta en tu Cementerio; Coloca 1 de estas cartas en tu Campo:
● 1 Mágica/Trampa que mencione ""Mago del Tiempo Oscuro"" (excepto ""Ladrón de Tumbas Insensato"") desde tu Cementerio.
● 1 Mágica/Trampa del Cementerio de tu adversario.	
Sólo puedes usar cada uno de los efectos de ""Ladrón de Tumbas Insensato"" una vez por turno.",Enviar al Cementerio,Colocar,Invocación Especial?,,,,,,,,,,,,,
101306071,Caja de Reversión,"Durante la Standby Phase: lanza 1 dado y después pon contadores en esta carta igual al número obtenido (máx. 6). 
Una vez por turno, cuando se activa un efecto de monstruo en el Campo de tu adversario, o cuando un monstruo del adversario ataca, durante el cálculo de daño: puedes retirar 1 contador de esta carta y seleccionar 1 de esos monstruos del adversario; lanza una moneda y adivina cara o cruz. Si aciertas, Invoca de Modo Especial 1 monstruo que mencione ""Mago del Tiempo Oscuro"" desde tu Deck, y si lo haces, el ATK del monstruo seleccionado se convierte en 0 y sus efectos son negados hasta el final de este turno.",Colocar un contador,Lanzar una moneda,Selecciona el número de contadores a colocar,,,,,,,,,,,,,
101306073,色鬼之虫毒,"这个卡名的卡在1回合只能发动1张。
①：可以从以下效果选择1个发动。
●这张卡当作通常怪兽（昆虫族·调整·暗·1星·攻/守0）在怪兽区域特殊召唤（不当作陷阱卡使用）。那之后，可以进行1只同调怪兽的同调召唤。
●以自己墓地1只「艮鬼」怪兽为对象才能发动。那只怪兽特殊召唤。",Activar,Invocar de Modo Especial como monstruo,Invoca de Modo Especial 1 monstruo desde el Cementerio,¿Invocación por Sincronía?,,,,,,,,,,,,
101306074,依鬼之咒咆,"这个卡名的卡在1回合只能发动1张。
①：可以从以下效果选择1个发动。
●这张卡当作通常怪兽（魔法师族·调整·暗·1星·攻/守0）在怪兽区域特殊召唤（不当作陷阱卡使用）。那之后，可以进行1只同调怪兽的同调召唤。
●自己场上或墓地有「艮鬼」怪兽存在的场合，以对方场上1只怪兽为对象才能发动。那只怪兽破坏。",Activar,Invocar de Modo Especial como monstruo,Efecto de destrucción,¿Invocación por Sincronía?,,,,,,,,,,,,
