101306075,剑鬼之神域,"这个卡名的卡在1回合只能发动1张。
①：可以从以下效果选择1个发动。
●这张卡当作通常怪兽（水族·调整·水·1星·攻/守0）在怪兽区域特殊召唤（不当作陷阱卡使用）。那之后，可以进行1只同调怪兽的同调召唤。
●对方把魔法·陷阱卡的效果发动时，若对方场上没有里侧表示卡存在则能发动。那个效果无效。",Activar,Invocar de Modo Especial como monstruo,Negar el efecto,¿Invocación por Sincronía?,,,,,,,,,,,,
101306076,Maelstrom de Dédalo,"Cuando tu adversario fuera a Invocar de Modo Normal o Especial uno o más monstruos mientras controlas ""Atlantis, la Ciudad Dragón"": niega la Invocación y, si lo haces, destruye ese o esos monstruos, y después si controlas un Monstruo de Enlace de AGUA, puedes destruir todos los monstruos que no sean de AGUA en el Campo. 
Puedes desterrar esta carta en tu Cementerio y mandar al Cementerio 1 ""Umi"" boca arriba que controles, y después seleccionar 1 monstruo que controle tu adversario; mándalo al Cementerio. 
Sólo puedes usar 1 de los efectos de ""Maelstrom de Dédalo"" por turno, y sólo una vez ese turno.",Negar la Invocación,Enviar al Cementerio,¿Destruir ese monstruo?,,,,,,,,,,,,,
101306149,Ficha Milagro ,"Invocada de Modo Especial con el efecto de ""Luminoso Adamancipador"".",,,,,,,,,,,,,,,,
101306154,Ficha de Cordero de Sacrificio,"Invocada de Modo Especial con el efecto de ""Scapegoats Soñolientas"".",,,,,,,,,,,,,,,,
101306254,Ficha de Cordero de Sacrificio,"Invocada de Modo Especial con el efecto de ""Scapegoats Soñolientas"".",,,,,,,,,,,,,,,,
101306354,Ficha de Cordero de Sacrificio,"Invocada de Modo Especial con el efecto de ""Scapegoats Soñolientas"".",,,,,,,,,,,,,,,,
101306454,Ficha de Cordero de Sacrificio,"Invocada de Modo Especial con el efecto de ""Scapegoats Soñolientas"".",,,,,,,,,,,,,,,,
