id,name,desc,str1,str2,str3,str4,str5,str6,str7,str8,str9,str10,str11,str12,str13,str14,str15,str16
100200290,Escenario del Destino,"Puedes activar esta carta desde tu mano revelando 1 Monstruo Normal en tu mano. 
Invoca de Modo Especial hasta 5 Monstruos Normales desde tu mano y/o Cementerio, y además por el resto de este turno, no puedes Invocar de Modo Especial desde el Deck Extra. 
Sólo puedes activar 1 ""Escenario del Destino"" una vez por turno.",Activar,"Activar aplicando el efecto de ""Escenario del Destino"".",,,,,,,,,,,,,,
100200291,Cápsula de Monstruos Ajedrez,"Durante la Main Phase: el jugador en turno puede seleccionar 1 monstruo en su Cementerio; lo coloca boca arriba en su Zona de Mágicas y Trampas como una Mágica Continua. 
Durante la End Phase: el jugador en turno puede mandar al Cementerio 1 Carta de Monstruo boca arriba que controle; Invoca de Modo Especial 1 monstruo desde su Deck con el mismo Tipo y Atributo original que ese monstruo, pero hasta 3 Niveles más alto que su Nivel original. 
Sólo puedes usar cada uno de los efectos de ""Cápsula de Monstruos Ajedrez"" una vez por turno.",,Colocar un monstruo,Invocación Especial,,,,,,,,,,,,,
100200292,Elfo Pura Sangre,"Durante tu Main Phase: puedes mandar al Cementerio 1 Mágica de Equipo desde tu Deck, y después esta carta gana 500 ATK hasta el final del turno de tu adversario. 
Sólo puedes usar este efecto de ""Elfo Pura Sangre"" una vez por turno. 
Cuando esta carta destruye un monstruo del adversario en batalla: puedes añadir a tu mano, o Invocar de Modo Especial, 1 monstruo Lanzador de Conjuros LUZ de Nivel 4 o menor desde tu Deck, excepto ""Elfo Pura Sangre"".",Enviar al Cementerio,Manipulación del Deck,,,,,,,,,,,,,,
100200293,León de Asalto,"Puedes Invocar esta carta por Sacrificio boca arriba Sacrificando 1 monstruo Guerrero-Bestia. 
Si esta carta batalla con un monstruo, cualquier daño de batalla que inflija a tu adversario se duplica. 
Si uno o más monstruos Guerrero-Bestia son Invocados de Modo Normal o Especial a tu Campo mientras esta carta está en tu Cementerio: puedes añadir esta carta a tu mano, e inmediatamente después de que este efecto se resuelva, puedes Invocarla por Sacrificio boca arriba y, si lo haces, gana 500 ATK, y además destiérrala cuando deje el Campo. 
Sólo puedes usar este efecto de ""León de Asalto"" una vez por turno.",Invocar por Sacrificio usando 1 monstruo Guerrero-Bestia,Añadir a la mano,¿Invocación por Sacrificio?,,,,,,,,,,,,,
100200294,Conexión de Poder,"Selecciona cualquier número de monstruos boca arriba que controles con el mismo Tipo; hasta el final de este turno, ganan 500 ATK por cada monstruo seleccionado. 
Si activaste ""Reencarnación del Armamento"" este turno: puedes añadir esta carta desde tu Cementerio a tu mano. 
Sólo puedes usar cada uno de los efectos de ""Conexión de Poder"" una vez por turno.",Activar,Recuperar,,,,,,,,,,,,,,
100260001,Sombrero de la Compañía de Payasos,"←◊7 Escala 7◊→
【Efecto de Péndulo】
Durante tu Main Phase: puedes mandar al Cementerio 1 carta ""Compañía de Payasos"" desde tu Deck, excepto un Monstruo de Péndulo y, si lo haces, Invoca esta carta de Modo Especial, y además no puedes activar los efectos de monstruos Invocados de Modo Especial desde el Deck o Deck Extra hasta el final del próximo turno. 
Sólo puedes usar este efecto de ""Sombrero de la Compañía de Payasos"" una vez por turno.
━━━━━━━━━━━━━━━━━━━━━━━
【Efecto de Monstruo】
Los monstruos que controle tu adversario pierden 1500 DEF mientras controles un monstruo Invocado por Sacrificio. 
Si esta carta es Sacrificada: puedes activar 1 de estos efectos (pero sólo puedes usar cada uno de estos efectos de ""Sombrero de la Compañía de Payasos"" una vez por turno);
● Baraja todos los Monstruos de Péndulo en el Campo y en los Decks Extra boca arriba al Deck.
● Invoca de Modo Especial 1 monstruo ""Compañía de Payasos"" desde tu Deck o Deck Extra, excepto un Monstruo de Péndulo, ignorando sus condiciones de Invocación.",Invocación Especial,Elegir un efecto,Devolver al Deck,Invocación Especial,,,,,,,,,,,,
100261001,Conejo Oscuro Divertido,"(Esta carta se trata como un monstruo Toon mientras ""Mundo Toon"" está en el Campo).	
Después de que esta carta sea Invocada de Modo Normal o Especial, durante tu Main Phase este turno, puedes Invocar de Modo Normal 1 monstruo que mencione ""Mundo Toon"" además de tu Invocación Normal/Colocada (sólo puedes ganar este efecto una vez por turno). 
Una vez por turno: puedes añadir a tu mano o Colocar boca arriba en tu Campo, 1 Mágica de Campo ""Toon"" o Mágica Continua ""Toon"" desde tu Deck.",,"Invocar por el efecto de ""Conejo Oscuro Divertido""",Efecto de añadir a la mano,Colocar,,,,,,,,,,,,
100261002,Gato Cómico,"(Esta carta se trata como un monstruo Toon mientras ""Mundo Toon"" está en el Campo).	
(Efecto Rápido): Durante la Main Phase: puedes Sacrificar 1 monstruo (si controlas ""Mundo Toon"", puedes Sacrificar 1 monstruo del adversario, aunque no lo controles), y si lo haces, Invoca de Modo Especial 1 monstruo desde tu mano o Deck que mencione ""Mundo Toon"", ignorando sus condiciones de Invocación. 
Sólo puedes usar este efecto de ""Gato Cómico"" una vez por turno.",,Invocación Especial,,,,,,,,,,,,,,
100261003,Caja Malvada,"(Esta carta se trata como un monstruo Toon mientras ""Mundo Toon"" está en el Campo).	
Si controlas ""Mundo Toon"": puedes Invocar esta carta de Modo Especial desde tu mano, y después puedes añadir a tu mano, o Colocar, 1 Trampa ""Toon"" desde tu Deck. 
Sólo puedes usar este efecto de ""Caja Malvada"" una vez por turno. 
Una vez por turno (Efecto Rápido): puedes seleccionar 1 carta en cualquier Cementerio; colócala en el fondo del Deck.",Invocación Especial,Recuperar del Cementerio,¿Seleccionar una Carta de Trampa?,,,,,,,,,,,,,
100261004,Ilusionista sin Rostro de Ojos Oscuros,"Puedes descartar esta carta para activar 1 de estos efectos (pero sólo puedes usar cada uno de estos efectos de ""Ilusionista sin Rostro de Ojos Oscuros"" una vez por turno);
● Coloca 1 ""Escáner Mental"" desde tu mano o Deck boca arriba en tu Campo.
● Añade a tu mano 1 monstruo que mencione ""Mundo Toon"" desde tu Cementerio, y después puedes Invocarlo de Modo Especial, ignorando sus condiciones de Invocación.	
Si esta carta batalla, ningún monstruo puede ser destruido en esa batalla.",Descartar,Colocar una Carta Trampa,Recuperar un monstruo,Invocación Especial?,,,,,,,,,,,,
100261005,Dragón Toon de Ojos Azules Definitivo,"""Dragón Toon de Ojos Azules"" + 2 monstruos Toon	
Debe ser Invocado de Modo Especial (desde tu Deck Extra) barajando al Deck/Deck Extra las cartas mencionadas arriba desde tu mano, Campo y/o Cementerio. 
Tus monstruos Toon pueden atacar directamente. 
Una vez por turno: puedes añadir a tu mano 1 carta ""Toon"", o 1 carta que mencione el nombre de una carta ""Toon"", desde tu Cementerio. 
Si tu monstruo Toon es atacado, durante el cálculo de daño: puedes desterrarlo hasta el final del Damage Step.",,Recuperar,Desterrar,,,,,,,,,,,,,
100261006,"Mundo Toon, el Mundo Perfecto","(El nombre de esta carta se convierte en ""Mundo Toon"" mientras está en la Zona del Campo).	
Una vez por turno: puedes añadir a tu mano 1 carta ""Toon"", o 1 carta que mencione el nombre de una carta ""Toon"", desde tu Deck. 
Sólo puedes usar este efecto de ""Mundo Toon, el Mundo Perfecto"" hasta tres veces por turno. 
Antes de resolver otra carta o efecto activado, puedes desterrar 1 monstruo Toon que controles hasta inmediatamente después de que esa carta o efecto se resuelva, y además no puedes desterrar monstruos con ese mismo nombre original con este efecto de esta carta por el resto de este turno.",,Añadir a la mano,,¿Desterrar el monstruo?,,,,,,,,,,,,
100261007,Escáner Mental,"Mientras haya una carta ""Toon"" en tu Campo o Cementerio, tu adversario debe jugar con su mano revelada todo el tiempo, y además puedes mirar sus cartas Colocadas. 
Si tienes un monstruo Toon y una Mágica ""Toon"" en tu Campo y/o Cementerio: puedes declarar 1 nombre de carta que no se haya activado en esta Cadena; mientras esta carta está boca arriba, hasta el final de este turno, niega los efectos activados de la carta declarada o de cartas con ese nombre original. 
Sólo puedes usar este efecto de ""Escáner Mental"" una vez por turno.",,Declarar,,,,,,,,,,,,,,
100261023,Terracottan Artibruja,"Si esta carta está en la mano: puedes seleccionar 1 carta ""Artibruja"" en tu Cementerio, excepto ""Terracottan Artibruja""; añádela a tu mano y, si lo haces, Invoca esta carta de Modo Especial, pero no puedes Invocar de Modo Especial desde el Deck Extra por el resto de este turno, excepto monstruos ""Artibruja"". 
Durante tu Main Phase: puedes Invocar por Fusión 1 Monstruo de Fusión ""Artibruja"", usando monstruos de tu mano y/o Campo como material. 
Sólo puedes usar cada uno de los efectos de ""Terracottan Artibruja"" una vez por turno.
",Invocación Especial,Invocación por Fusión,,,,,,,,,,,,,,
100261024,Marka Artibruja,"Puedes Sacrificar esta carta en tu mano o Campo; añade a tu mano 1 Mágica de Campo o Continua ""Artibruja"" desde tu Deck. 
Si uno o más monstruos ""Artibruja"" boca arriba que controles dejan el Campo por el efecto de una carta del adversario mientras esta carta está en tu Cementerio: puedes Invocar esta carta de Modo Especial (pero destiérrala cuando deje el Campo) y, si lo haces, Sacrifica 1 monstruo del adversario. 
Sólo puedes usar cada uno de los efectos de ""Marka Artibruja"" una vez por turno.",Añadir a la mano,Invocación Especial,,,,,,,,,,,,,,
100261025,Artibruja Madame Rilliona,"""Artibruja Madame Vidria"" + 2 Lanzadores de Conjuros	
Si esta carta es Invocada por Fusión: puedes Invocar de Modo Especial hasta 3 monstruos ""Artibruja"" de Nivel 7 o menor con diferentes Atributos desde tu mano y/o Deck, y además no puedes Invocar de Modo Especial desde el Deck Extra por el resto de este turno, excepto Monstruos de Fusión. 
Durante tu End Phase, si esta carta está en tu Cementerio: puedes revelar 1 Mágica en tu mano; Invoca esta carta de Modo Especial en Posición de Defensa. 
Sólo puedes usar cada uno de los efectos de ""Artibruja Madame Rilliona"" una vez por turno.",Invocar de Modo Especial desde el Deck,Invocar esta carta de Modo Especial,,,,,,,,,,,,,,
100261026,Artibruja Aprendices,"1 monstruo ""Artibruja"" + 1 monstruo Lanzador de Conjuros	
(Efecto Rápido): Durante la Main Phase o Battle Phase: puedes activar 1 de estos efectos;
● Añade a tu mano 1 Mágica ""Artibruja"" desde tu Deck.
● Revela 1 Mágica Normal o de Juego Rápido ""Artibruja"" en tu mano; aplica el efecto de activación de esa Mágica.	
Durante tu End Phase: puedes devolver al Cementerio 1 de tus cartas ""Artibruja"" desterradas. 
Sólo puedes usar cada uno de los efectos de ""Artibruja Aprendices"" una vez por turno.",Activar,Volver al Cementerio,Efecto de añadir a la mano,Copiar efecto,,,,,,,,,,,,
100261027,Celebración Artibruja,"Puedes usar uno de los siguientes efectos:
● Destruye 1 monstruo ""Artibruja"" que controles y 1 carta que controle tu adversario.
● Puedes Invocar por Fusión 1 Monstruo de Fusión ""Artibruja"" barajando al Deck monstruos Artibruja desde tu Cementerio y destierro.	
Durante tu End Phase, si esta carta está en tu Cementerio mientras controlas un monstruo ""Artibruja"", puedes: añadir esta carta a tu mano. 
Sólo puedes usar 1 de los efectos de ""Celebración Artibruja"" por turno, y sólo una vez ese turno.",Activar,Añadir a la mano,Efecto de destrucción,Invocación por Fusión,,,,,,,,,,,,
100261028,Walpurgis Artibruja,"Durante tu Main Phase, puedes: añade a tu mano 1 monstruo ""Artibruja"" desde tu Deck, y después descarta 1 carta. 
Sólo puedes usar este efecto de ""Walpurgis Artibruja"" una vez por turno. 
Durante tu turno, si fueras a descartar una carta para activar el efecto de un monstruo ""Artibruja"", puedes en su lugar mandar al Cementerio 1 Carta Mágica/Trampa ""Artibruja"" desde tu Deck, excepto ""Walpurgis Artibruja"".",Añadir a la mano,,,,,,,,,,,,,,,
100261029,Distorsión Artibruja,"Cuando tu adversario activa una Carta Mágica/Trampa o un efecto de monstruo, y controlas un monstruo ""Artibruja"" de Nivel 5 o mayor: niega la activación y, si lo haces, destruye esa carta. 
Excepto en el turno en que esta carta fue mandada al Cementerio: puedes desterrar esta carta en el Cementerio; añade a tu mano 1 monstruo Lanzador de Conjuros de Nivel 5 o mayor desde tu Deck, y después descarta 1 carta. 
Sólo puedes usar cada uno de los efectos de ""Distorsión Artibruja"" una vez por turno.",Activar,Añadir a la mano,,,,,,,,,,,,,,
100261047,Ogra Desencadenada de Shara,"(Efecto Rápido): Durante la Main Phase: puedes descartar esta carta; Invoca de Modo Especial 1 monstruo Demonio desde tu mano, y después destruye 1 carta que controles. 
Si una carta en el Campo es destruida en batalla, o por un efecto de una carta ""Desencadenado/a"" que no sea ""Ogra Desencadenada de Shara"", mientras esta carta está en el Cementerio: puedes añadir esta carta a tu mano, o Invocarla de Modo Especial (pero si la Invocas de Modo Especial, colócala en el fondo del Deck cuando deje el Campo). 
Sólo puedes usar cada uno de los efectos de ""Ogra Desencadenada de Shara"" una vez por turno.",Invocación Especial,Recuperar,,,,,,,,,,,,,,
100261048,Ogro Desencadenado de Shma,"Si esta carta es Invocada de Modo Normal: puedes Invocar de Modo Especial 1 monstruo ""Desencadenado/a"" de Nivel 4 o menor desde tu Deck (excepto ""Ogro Desencadenado de Shma""), y después destruye 1 carta que controles, y además por el resto de este turno, no puedes Invocar de Modo Especial, excepto monstruos Demonio. 
Si esta carta en el Campo es destruida en batalla, o por un efecto de una carta ""Desencadenado/a"" que no sea ""Ogro Desencadenado de Shma"": puedes Invocar de Modo Especial 1 monstruo ""Desencadenado/a"" desde tu mano o Deck, excepto ""Ogro Desencadenado de Shma"". 
Sólo puedes usar cada uno de los efectos de ""Ogro Desencadenado de Shma"" una vez por turno.",Invocar de Modo Especial desde el Deck,Invocar de Modo Especial desde tu mano/Deck,,,,,,,,,,,,,,
100261049,Magistrado Malévolo Desencadenado de Kamura,"Puedes seleccionar hasta 3 cartas que controles; destrúyelas y, si lo haces, Invoca esta carta de Modo Especial desde tu mano, y después puedes aplicar estos efectos, en secuencia, basados en los tipos originales de las cartas destruidas.
● Monstruo: Roba 1 carta.
● Mágica: Cambia la posición de batalla de 1 monstruo.
● Trampa: Destruye 1 otra carta en el Campo.	
Si esta carta en el Campo es destruida por efecto de carta: puedes destruir todos los monstruos en el Campo. 
Sólo puedes usar cada uno de los efectos de ""Magistrado Malévolo Desencadenado de Kamura"" una vez por turno.",Invocación Especial,Efecto de destrucción,¿Robar 1 carta?,¿Cambiar la posición de batalla?,¿Destruir?,,,,,,,,,,,
100261050,Enma Desencadenado Señor de Yama,"2+ monstruos incluyendo un monstruo ""Alma Desencadenada""	
Durante tu End Phase: puedes seleccionar hasta 2 monstruos Demonio en tu Cementerio que fueron destruidos este turno; Invócalos de Modo Especial, pero mientras están boca arriba en la Zona de Monstruos, no puedes Invocar de Modo Especial, excepto monstruos Demonio. 
Si esta carta en el Campo fuera a ser destruida en batalla o por efecto de carta, puedes destruir 1 carta boca arriba en cualquier Campo en su lugar. 
Sólo puedes usar cada uno de los efectos de ""Enma Desencadenado Señor de Yama"" una vez por turno.",Invocación Especial,,"Invocado de Modo Especial por el efecto de ""Enma Desencadenado Señor de Yama""",,,,,,,,,,,,,
100261051,Alma Desencadenada de Rabia Abominadora,"2+ monstruos incluyendo un monstruo Demonio	
Si tu adversario Invoca de Modo Especial un monstruo boca arriba: puedes seleccionar 1 de ellos; destruye 1 monstruo Demonio que controles y, si lo haces, niega sus efectos hasta el final de este turno. 
(Efecto Rápido): Cuando se activa un efecto de monstruo en el Campo mientras controlas un monstruo ""Desencadenado/a"" de Link-4 o mayor: puedes desterrar esta carta en tu Cementerio; destruye ese monstruo. 
Sólo puedes usar cada uno de los efectos de ""Alma Desencadenada de Rabia Abominadora"" una vez por turno.",Negar,Destruir,,,,,,,,,,,,,,
100261052,Reencarnación de los Desencadenados,"Cuando esta carta se resuelve, puedes añadir a tu mano 1 Mágica ""Desencadenado/a"" excepto ""Reencarnación de los Desencadenados"" o 1 ""Prisión de la Abominación"" desde tu Deck. 
Una vez por turno: puedes seleccionar hasta 3 cartas ""Desencadenado/a"" en tu Cementerio, excepto ""Reencarnación de los Desencadenados""; barájalas al Deck, y después puedes destruir otras cartas que controles hasta el número de cartas barajadas. 
Sólo puedes activar 1 ""Reencarnación de los Desencadenados"" por turno.",Añadir a la mano?,Efecto de recuperación,¿Destruir la carta?,,,,,,,,,,,,,
100261053,Sincretismo Desencadenado,"Selecciona 2 monstruos boca arriba en cualquier Campo, incluyendo 1 Monstruo de Enlace ""Desencadenado/a"" que controles; inmediatamente después de que este efecto se resuelva, Invoca por Enlace 1 Monstruo de Enlace ""Desencadenado/a"", usando sólo esos 2 monstruos como material. 
Si esta carta Colocada en el Campo es destruida: puedes Invocar de Modo Especial 1 monstruo ""Desencadenado/a"" desde tu Deck. 
Sólo puedes usar cada uno de los efectos de ""Sincretismo Desencadenado"" una vez por turno.",Invocación de Enlace,Invocación Especial,,,,,,,,,,,,,,
100263001,Tirano Oscuro,"Si tu adversario sólo controla monstruos en Posición de Defensa, esta carta puede atacar directamente. 
Sólo puedes usar cada uno de los siguientes efectos de ""Tirano Oscuro"" una vez por turno. 
Durante tu Main Phase, si se ha activado un efecto de Mágica este turno: puedes Invocar esta carta de Modo Especial desde tu mano. 
Si esta carta es mandada al Cementerio: puedes añadir a tu mano 1 monstruo Dinosaurio de Nivel 8 o mayor desde tu Deck, y después, si tu adversario controla un monstruo, puedes Invocarlo de Modo Especial desde tu mano.",Invocación Especial,Añadir a la mano,Invocación Especial?,,,,,,,,,,,,,
100263002,Fuerza Arcana XII - El Colgado,"Si se activa un efecto: puedes revelar esta carta en tu mano a tu adversario; Invoca de Modo Especial 1 monstruo ""Fuerza Arcana"" desde tu mano en Posición de Defensa. 
Sólo puedes usar este efecto de ""Fuerza Arcana XII - El Colgado"" una vez por turno. 
Si esta carta es Invocada: lanza una moneda.
● Cara: Destruye 1 monstruo que controles y recibe daño igual a su ATK original.
● Cruz: Destruye 1 monstruo que controle tu adversario e inflige daño a tu adversario igual a su ATK original.
",Invocación Especial,Efecto de lanzamiento de moneda,,,,,,,,,,,,,,
100263003,Bestia Fantasma Luninosa - Candelard,"Aumenta el ATK/DEF de esta carta en 1000 x el número de cartas en tu mano. 
Sólo puedes usar los siguientes efectos de ""Bestia Fantasma Luninosa - Candelard"" una vez por turno. 
Puedes descartar otras 2 cartas mientras esta carta está en tu mano; Invoca esta carta de Modo Especial, y después puedes añadir a tu mano 1 carta cuyo efecto incluya un lanzamiento de moneda desde tu Deck. 
Si fuera a activarse un Efecto de Monstruo, Mágica o Trampa que incluya añadir una carta del Deck a la mano, puedes: negar ese efecto.",Invocación Especial,Negar,Añadir a la mano?,,,,,,,,,,,,,
100263004,Guerrero de Plasma Eitöm,"(Esta carta se trata siempre como una carta ""Guerrero Magno"").	
Esta carta no puede ser Invocada de Modo Especial excepto desde tu mano o Cementerio Sacrificando 1 monstruo de Nivel 7 o mayor que controles, una vez por turno. 
Una vez por turno, puedes mandar al Cementerio 1 monstruo ""Guerrero Magnético"" o monstruo ""Guerrero Magno"" desde tu Deck, excepto ""Guerrero de Plasma Eitöm""; este turno, el ATK original de esta carta se convierte en 1500 y puede atacar directamente.",,Ataque directo,,,,,,,,,,,,,,
100263005,Señor de los Caballeros Blancos,"Puedes desterrar 3 monstruos en tu Cementerio; Invoca esta carta de Modo Especial desde tu mano, y después puedes aplicar uno de los siguientes efectos:
● Invoca de Modo Especial 1 ""Caballero Blanco"" o un monstruo ""Noche Blanca"" desde tu mano o Deck.
● Añade a tu mano 1 ""Velo Blanco"" desde tu Deck.	
Sólo puedes usar este efecto de ""Señor de los Caballeros Blancos"" una vez por turno. 
Cuando se declara un ataque entre esta carta y un monstruo del adversario, el ATK del monstruo del adversario se convierte en 0. 
Si esta carta es destruida por tu adversario: tu adversario recibe 1000 puntos de daño.",Invocación Especial,El ATK se convierte en 0,Infligir daño,No resolver el efecto,Invocación Especial,Añadir a la mano,,,,,,,,,,
100263006,Señor de la Perdición Invencible,"Durante la End Phase en la que uno o más monstruos fueron destruidos en batalla, puedes: Invocar esta carta de Modo Especial desde tu mano o Cementerio. Si un ""Señor de la Perdición Invencible"" fue destruido en batalla este turno, este monstruo Invocado de Modo Especial por este efecto tiene un ATK original de 3000 y no puede ser destruido por efectos. 
Durante tu Main Phase, puedes: revelar una cantidad de cartas de tu Deck igual al número de cartas que controle tu adversario +1, incluyendo una ""Desenvainar Espada"", y devolverlas a la parte superior de tu Deck en cualquier orden. 
Sólo puedes usar cada efecto de ""Señor de la Perdición Invencible"" una vez por turno.",Invocación Especial,Colocar en la parte superior del Deck,Selecciona una carta para colocar en la parte superior del Deck.,,,,,,,,,,,,,
100263007,HÉROE Elemental Clayguardman,"1 monstruo ""HÉROE Elemental"" + 1 monstruo Guerrero	
Si esta carta es Invocada de Modo Especial, puedes: Invocar de Modo Especial 1 monstruo ""HÉROE Elemental"" desde tu Deck. Si tu adversario controla cartas, puedes infligir daño a sus LP igual a 400 x el número de cartas que controle. Sólo puedes Invocar de Modo Especial monstruos ""HÉROE Elemental"" desde tu Deck Extra este turno. 
Sólo puedes usar este efecto de ""HÉROE Elemental Clayguardman"" una vez por turno. 
Mientras esta carta está en una Zona de Monstruos, otros monstruos ""HÉROE Elemental"" que controles no pueden ser destruidos en batalla ni por efectos.",Invocación Especial,¿Infligir daño?,,,,,,,,,,,,,,
100263008,Martillo de Muñeca,"Selecciona 1 monstruo que controles; destrúyelo, y después roba 2 cartas. Después de eso, puedes cambiar la posición de batalla de 1 monstruo que controle tu adversario. 
Si un monstruo es Invocado de Modo Especial desde tu Cementerio, mientras esta carta está en tu Cementerio: puedes añadir esta carta a tu mano. 
Sólo puedes usar cada efecto de ""Martillo de Muñeca"" una vez por turno.
",Activar,Recuperar,¿Cambiar la posición de batalla?,,,,,,,,,,,,,
100263009,Invocación Rápida,"Inmediatamente después de que este efecto se resuelva, Invoca de Modo Normal 1 monstruo. Si tu adversario controla un monstruo, puedes Invocar de Modo Normal un monstruo de Nivel 5 o mayor sin Sacrificio con este efecto. 
Sólo puedes usar el siguiente efecto de ""Invocación Rápida"" una vez por turno.
● Durante tu Main Phase, excepto en el turno en que esta carta fue mandada al Cementerio: puedes desterrar esta carta en tu Cementerio; añade a tu mano 1 monstruo de Nivel 5 o mayor que pueda ser Invocado de Modo Normal desde tu Deck o Cementerio, y después Invoca ese monstruo por Sacrificio.",Activar,Añadir a la mano,¿Aplicar el efecto de {CARD} para Invocar sin Sacrificar?,,,,,,,,,,,,,
100263010,D- Explosión,"Puedes seleccionar 1 Carta Mágica boca arriba que controles; destrúyela y roba 1 carta, y después si controlas un monstruo ""HÉROE del Destino"", puedes Invocar de Modo Especial 1 monstruo ""HÉROE del Destino"" desde tu mano, Cementerio o destierro. 
Al final del Damage Step cuando un monstruo equipado con una Carta de Equipo o ""HÉROE del Destino - Dogma"" atacó, puedes desterrar esta carta en tu Cementerio; ese monstruo puede atacar una vez más. 
Sólo puedes activar 1 ""D- Explosión"" por turno.",Robar,Realizar otro ataque,Invocación Especial?,,,,,,,,,,,,,
100264002,Origen del Archidemonio,"Si esta carta está en tu mano: puedes Sacrificar otro monstruo ""Archidemonio"" en tu mano o Campo; Invoca esta carta de Modo Especial. 
Si esta carta es Invocada de Modo Normal o Especial: puedes Invocar de Modo Especial 1 monstruo Demonio de Nivel 6 con 2500 ATK desde tu mano, Deck o Cementerio. 
Cuando tu adversario activa un efecto de monstruo, mientras controlas ""Cráneo Convocado"" (Efecto Rápido): puedes negar la activación y, si lo haces, destruye esa carta. 
Sólo puedes usar cada uno de los efectos de ""Origen del Archidemonio"" una vez por turno.",Invocar esta carta de Modo Especial,Invocación Especial,Negar y destruir,,,,,,,,,,,,,
100264003,Relámpago del Archidemonio,"Selecciona 1 monstruo ""Archidemonio"" que controles; gana 600 ATK, y después puedes destruir todos los monstruos que controle tu adversario cuyo ATK original sea menor que el ATK actual de ese monstruo. 
Durante la Main Phase: puedes desterrar esta carta en el Cementerio, y después seleccionar 1 monstruo Demonio de Nivel 6 con 2500 ATK en tu Cementerio; añádelo a tu mano. 
Sólo puedes usar cada uno de los efectos de ""Relámpago del Archidemonio"" una vez por turno.",Activar,Recuperar,¿Destruir ese monstruo?,,,,,,,,,,,,,
