101305064,Verano,"Una vez por turno: puedes poner Contadores de Estación en esta carta igual al número de Zonas de Monstruos Principales sin usar de tu adversario. 
Una vez por turno, cuando tu monstruo declara un ataque: puedes infligir 400 puntos de daño a tu adversario por cada Contador de Estación en esta carta y ""Primavera"" en tu Cementerio. 
Una vez por turno, durante la End Phase de tu adversario: puedes Colocar 1 Mágica de Campo en tu mano o Deck en la que puedas poner Contadores de Estación boca arriba en tu Campo y, si lo haces, pon los Contadores de Estación de esta carta en ella, pero ningún jugador puede activar sus efectos este turno.",Colocar un contador,Infligir daño,Coloca una Magia de Campo,,,,,,,,,,,,,
101305065,Mezcla Mental,"(Efecto Rápido): Puedes añadir a tu mano 1 monstruo que mencione ""Ritual de Luz y Oscuridad"" desde tu Deck, y después descartar 1 carta. 
Sólo puedes usar este efecto de ""Mezcla Mental"" una vez por turno. 
Cuando tu adversario activa una carta o efecto: puedes devolver a la mano 1 monstruo de Nivel 7 o mayor que controles; Invoca de Modo Especial 1 monstruo con nombre diferente desde tu mano que mencione ""Ritual de Luz y Oscuridad"", ignorando sus condiciones de Invocación. 
No puedes activar los efectos de esta carta ""Mezcla Mental"" en la misma Cadena.
",Efecto de añadir a la mano,Invocación Especial,,,,,,,,,,,,,,
101305066,Canto de Destrucción de las Bestias Sagradas,"Invoca de Modo Especial 1 monstruo ""Bestia Sagrada"" desde tu mano o Cementerio en Posición de Defensa, y después, si controlas 2 o más monstruos ""Bestia Sagrada"" cuyo Nivel original sea 10, puedes negar los efectos de 1 carta boca arriba que controle tu adversario, y si lo haces, destrúyela. 
Puedes desterrar esta carta en tu Cementerio; Invoca por Fusión 1 Monstruo de Fusión ""Fantasma"" desde tu Deck Extra, usando monstruos de tu mano o Campo. 
Sólo puedes usar cada uno de los efectos de ""Canto de Destrucción de las Bestias Sagradas"" una vez por turno.",Invocación Especial,Invocación por Fusión,¿Negar los efectos de la carta?,,,,,,,,,,,,,
101305067,Abismo Divino de las Bestias Sagradas,"Puedes mandar al Cementerio 3 ""Abismo Divino de las Bestias Sagradas"" boca arriba que controles, incluyendo esta carta, y después seleccionar 1 monstruo boca arriba que controle tu adversario; cámbialo a Posición de Defensa boca abajo. 
Sólo puedes usar cada uno de los siguientes efectos de ""Abismo Divino de las Bestias Sagradas"" una vez por turno. 
Durante la Main Phase: puedes Colocar 2 ""Abismo Divino de las Bestias Sagradas"" desde tu mano, Deck y/o Cementerio boca arriba en tu Campo. 
Durante la End Phase de tu adversario, si esta carta está en tu Cementerio: puedes colocarla en el fondo del Deck.",Colocar boca arriba,Cambiar a Posición de Defensa boca abajo,Devolver al Deck,,,,,,,,,,,,,
101305068,Golpe de Retorno Blitzclique,"Los monstruos ""Blitzclique"" que controles no pueden ser destruidos por efectos de cartas de tu adversario. 
Sólo puedes usar cada uno de los siguientes efectos de ""Golpe de Retorno Blitzclique"" una vez por turno. 
Cuando tu adversario activa una Carta Mágica o efecto: puedes devolver a la mano 1 monstruo ""Blitzclique"" que controles; niega el efecto y, si lo haces, destruye esa carta. 
Puedes desterrar esta carta en tu Cementerio y seleccionar 1 monstruo ""Blitzclique"" que controles o en tu Cementerio; devuélvelo a la mano.",,Negar el efecto,Recuperar un monstruo,,,,,,,,,,,,,
101305069,Alternador Blitzclique,"Los monstruos que controle tu adversario pierden 300 ATK/DEF por cada monstruo Trueno que controles. 
Sólo puedes usar cada uno de los siguientes efectos de ""Alternador Blitzclique"" una vez por turno. 
Puedes barajar al Deck 1 otra carta ""Blitzclique"" en tu mano o Campo boca arriba; añade a tu mano 1 monstruo Trueno con nombre diferente desde tu Deck. 
Puedes desterrar esta carta en tu Cementerio; añade a tu mano 1 Mágica ""Blitzclique"" o 1 ""Kowloon, la Ciudadela del Cielo"" desde tu Deck.",,Añadir a la mano un monstruo,Añadir una Mágica a la mano,,,,,,,,,,,,,
101305070,Nombre Mágico – “Rosa Mundi”,"Destierra 1 monstruo ""Aleister"" o 1 Monstruo de Fusión en tu Cementerio; Invoca de Modo Especial 1 monstruo ""Invokado/a"" desde tu Deck Extra, ignorando sus condiciones de Invocación, pero destiérralo durante la End Phase. 
Si uno o más monstruos son desterrados boca arriba mientras esta carta está en tu Cementerio: puedes desterrar esta carta, y después seleccionar 1 de tus monstruos ""Invokado/a"" desterrados; Invócalo de Modo Especial. 
Sólo puedes usar cada uno de los efectos de ""Nombre Mágico – ""Rosa Mundi"""" una vez por turno.",Invocación Especial,Invocación Especial,,,,,,,,,,,,,,
101305071,Sombras del Apocalipsis del Modelo de Poder,"Invoca de Modo Especial 1 monstruo ""Modelo de Poder"" desde tu mano, Deck Extra boca arriba o Cementerio, y después puedes aplicar estos efectos, en secuencia, según el número de tipos de carta de monstruo (Fusión, Sincronía, Xyz) que controles.
● 1+: Destierra las 3 cartas de la parte superior del Deck de tu adversario boca abajo.
● 2+: Destierra 1 carta que controle tu adversario boca abajo.
● 3: Destierra al azar 1 carta de la mano de tu adversario boca abajo.		
Sólo puedes activar 1 ""Sombras del Apocalipsis del Modelo de Poder"" por turno.",Activar,¿Desterrar cartas del Deck?,¿Desterrar una carta en el Campo?,¿Desterrar 1 carta de tu mano?,,,,,,,,,,,,
101305072,Elfnotas: Cuarteto de la Sucesión,"El monstruo en tu Zona de Monstruos Principal central no puede ser desterrado por efectos de cartas de tu adversario. 
Puedes mandar al Cementerio 1 otra Mágica/Trampa en tu mano o Campo y declarar un Nivel del 1 al 4; Invoca de Modo Especial 1 ""Ficha Serafín Elfnota"" (Planta/Cantante/FUEGO/ATK 0/DEF 0) con ese Nivel, pero no puedes Invocar de Modo Especial desde el Deck Extra mientras esa Ficha esté en el Campo, excepto monstruos ""Elfnota"". 
Sólo puedes usar este efecto de ""Elfnotas: Cuarteto de la Sucesión"" una vez por turno.",,Invocación Especial,,,,,,,,,,,,,,
101305073,Los Caballeros Fantasma del Velo de Sombra,"Invoca esta carta de Modo Especial como un Monstruo Normal (Guerrero/OSCURIDAD/Nivel 3/ATK 0/DEF 300) en Posición de Defensa (NO se trata como Trampa), y después puedes cambiar a Posición de Defensa 1 monstruo en Posición de Ataque del adversario. 
Puedes desterrar esta carta en tu Cementerio; inmediatamente después de que este efecto se resuelva, Invoca Xyz 1 monstruo de OSCURIDAD. 
Sólo puedes usar cada uno de los efectos de ""Los Caballeros Fantasma del Velo de Sombra"" una vez por turno. 
Si tienes un monstruo ""Los Caballeros Fantasma"" en tu Campo o en tu Cementerio, puedes activar esta carta en el turno en que fue Colocada.","Activar aplicando el efecto de ""Los Caballeros Fantasma del Velo de Sombra"".",Invocación Xyz,¿Cambiar la posición de batalla?,,,,,,,,,,,,,
101305074,Mundo Sistematizado Fuerza-S,"Si fueras a desterrar una carta de tu mano para activar el efecto de un monstruo ""Fuerza-S"", puedes en su lugar mandar al Cementerio 1 carta ""Fuerza-S"" desde tu Deck, excepto ""Mundo Sistematizado Fuerza-S"". 
Si otra carta es desterrada, puedes seleccionar 1 carta que controle tu adversario o en su Cementerio; destiérrala, y después puedes mover un monstruo ""Fuerza-S"" que controles a otra de tus Zonas de Monstruos Principal. 
Sólo puedes usar cada efecto de ""Mundo Sistematizado Fuerza-S"" una vez por turno.",,Desterrar,¿Mover a otra zona?,,,,,,,,,,,,,
101305075,Tiempo Cálido Melffy,"Selecciona 1 monstruo ""Melffy"" en tu Campo o Cementerio; añádelo a tu mano, y después puedes Invocar por Fusión 1 Monstruo de Fusión Bestia, usando monstruos de tu mano y/o Campo como material. 
Si controlas un Monstruo Xyz ""Melffy"": puedes desterrar esta carta en el Cementerio; este turno, los monstruos ""Melffy"" Invocados de Modo Especial desde el Deck Extra que controles no son afectados por efectos activados de tu adversario. 
Sólo puedes usar cada uno de los efectos de ""Tiempo Cálido Melffy"" una vez por turno.",Devolver a la mano,No afectado,¿Invocación por Fusión?,,,,,,,,,,,,,
101305076,"Compañía de Payasos - ""Final""","Si controlas un monstruo Invocado por Sacrificio: puedes descartar cualquier número de cartas, y después seleccionar esa misma cantidad de cartas boca arriba en el Campo; destrúyelas. 
Puedes desterrar esta carta en tu Cementerio y Sacrificar 1 Monstruo de Ritual, Fusión, Sincronía, Xyz, Péndulo o Enlace en tu mano o Campo; añade a tu mano 1 monstruo ""Compañía de Payasos"" desde tu Deck o Cementerio con un Nivel/Rango/Valor de Enlace original que no sea igual al del monstruo Sacrificado. 
Sólo puedes usar cada uno de los efectos de ""Compañía de Payasos - ""Final"""" una vez por turno.",Efecto de destrucción,Efecto de añadir a la mano,,,,,,,,,,,,,,
101305077,"¡Oh, Mi Agujero Trampa!","Cuando se activa un efecto de monstruo en el Campo de tu adversario durante el turno en que Invocó de Modo Especial uno o más monstruos: destruye el monstruo que activó ese efecto, y después destruye todas las cartas del adversario en sus Zonas de Monstruos adyacentes y Zonas de Mágicas y Trampas (si las hay).",Activar,,,,,,,,,,,,,,,
101305078,Restricción de Carril,"(Nota: Temporalmente no disponible para usar correctamente)	
(La implementación del efecto ② de esta carta tiene un bug grave. Por el momento no se aceptarán reportes relacionados con el efecto ② de esta carta).	

①: Cuando esta carta se resuelve, puedes Invocar de Modo Especial 1 de tus monstruos desterrados a tu Zona de Monstruos Principal más a la derecha. 
②: Si tu adversario Invoca de Modo Normal o Especial uno o más monstruos a su Zona de Monstruos Principal, debe usar la(s) zona(s) desocupada(s) más a la izquierda.",,Invocación Especial?,,,,,,,,,,,,,,
101305079,Retroluz Aniquiladora,"Cuando tu adversario activa el efecto de un monstruo que controle que no fue Invocado este turno: niega la activación, y después puedes desterrar (boca abajo) todos los monstruos boca arriba que controle que no fueron Invocados este turno. 
Si esta carta Colocada bajo el control de su dueño es destruida por el efecto de una carta del adversario: puedes Colocar 1 Trampa desde tu Deck.",Activar,Colocar,¿Desterrar el monstruo?,,,,,,,,,,,,,
101305080,Jardines de Piedra Sagrada,"Si tienes las 5 Zonas de Mágicas y Trampas ocupadas, los jugadores reciben la mitad del daño de batalla, y además una vez por turno, puedes activar 1 Trampa Continua en el turno en que fue Colocada. 
Durante la Standby Phase: puedes revelar 5 Trampas Continuas con nombres diferentes desde tu Deck, tu adversario elige 1 de ellas al azar para que la Coloques en tu Campo, baraja el resto al Deck. 
Sólo puedes usar este efecto de ""Jardines de Piedra Sagrada"" una vez por turno.","Activar aplicando el efecto de ""Jardines de Piedra Sagrada"".",,,,,,,,,,,,,,,
101305150,Ficha Mechbestia,"Invocada de Modo Especial con el efecto de ""Kowloon, la Ciudadela del Cielo"".",,,,,,,,,,,,,,,,
101305172,Ficha Serafín Elfnota,"Invocada de Modo Especial con el efecto de ""Elfnotas: Cuarteto de la Sucesión"".",,,,,,,,,,,,,,,,
101306001,Guerrero Pantera Veloz,"Sólo puedes usar el siguiente efecto de ""Guerrero Pantera Veloz"" una vez por turno. 
(Efecto Rápido): Durante la Main Phase, puedes Sacrificar otro monstruo en tu mano o Campo y aplicar uno de los siguientes efectos:
● Invoca de Modo Especial 1 monstruo que mencione ""Mago del Tiempo Oscuro"", excepto ""Guerrero Pantera Veloz"", desde tu mano o Deck.
● Manda al Cementerio 1 Carta Mágica/Trampa que mencione ""Mago del Tiempo Oscuro"" desde tu Deck.	
Esta carta no puede declarar un ataque a menos que un monstruo haya sido Sacrificado este turno.",Activar el efecto,,Invocación Especial,Enviar al Cementerio,,,,,,,,,,,,
101306002,"Aligátor de la Espada, el Caballero Dragón","Esta carta puede atacar directamente. 
Sólo puedes usar cada uno de los siguientes efectos de ""Aligátor de la Espada, el Caballero Dragón"" una vez por turno. 
Mientras esta carta está en tu mano, puedes revelar otra carta en tu mano que mencione ""Mago del Tiempo Oscuro""; Invoca esta carta de Modo Especial. 
Si esta carta es Invocada de Modo Normal o Especial: puedes añadir a tu mano 2 Cartas Mágicas/Trampa que mencionen ""Mago del Tiempo Oscuro"", y después descartar 1 carta.",Invocación Especial,Añadir a la mano,,,,,,,,,,,,,,
101306003,Jinzo - Impactador Psicoenergético,"Esta carta también se trata como ""Jinzo"" mientras está en el Campo o en el Cementerio. 
Si esta carta es Invocada de Modo Normal o Especial: puedes destruir todas las Cartas Trampa que controle tu adversario (revela y confirma las cartas Colocadas) y después aumenta el ATK de esta carta en 300 x el número de cartas destruidas por este efecto. 
Sólo puedes usar este efecto de ""Jinzo - Impactador Psicoenergético"" una vez por turno. 
Mientras controles otro monstruo que mencione ""Mago del Tiempo Oscuro"", tu adversario no puede activar los efectos de Cartas Trampa.",Destruir,,,,,,,,,,,,,,,
101306004,"El Pescador, la Leyenda del Gran Mar","Si tu adversario activa un efecto de monstruo en el Campo, o cuando un monstruo del adversario declara un ataque, mientras hay una carta que mencione ""Mago del Tiempo Oscuro"" (excepto ""El Pescador, la Leyenda del Gran Mar"") o ""Umi"" en el Campo: puedes Invocar esta carta de Modo Especial desde tu mano. 
Si esta carta es Invocada de Modo Especial: puedes seleccionar 1 monstruo que controle tu adversario; destrúyelo, y además devuelve esta carta a la mano durante la End Phase de este turno. 
Sólo puedes usar cada uno de los efectos de ""El Pescador, la Leyenda del Gran Mar"" una vez por turno.",Invocación Especial,Destruir,,,,,,,,,,,,,,
101306021,HÉROE del Destino – Death Dogma,"No puede ser Invocado de Modo Normal/Colocado. Debe ser Invocado de Modo Especial (desde tu mano o Cementerio) desterrando 3 monstruos Guerrero y/o de OSCURIDAD en tu Cementerio. 
Sólo puedes Invocar de Modo Especial ""HÉROE del Destino – Death Dogma"" una vez por turno de esta forma. 
Si es Invocado de esta forma: puedes activar este efecto; inflige 2000 puntos de daño a tu adversario durante la próxima Standby Phase. 
Una vez por turno, cuando tu adversario activa una carta o efecto (Efecto Rápido): puedes Invocar por Fusión 1 monstruo de OSCURIDAD o Guerrero desde tu Deck Extra, barajando al Deck sus materiales desde tu mano, Campo y/o Cementerio.",,Infligir daño,Invocación por Fusión,,,,,,,,,,,,,
101306022,HÉROE del Destino – Doom Liege,"Si esta carta es Invocada de Modo Normal o Especial: puedes seleccionar 1 monstruo que controle tu adversario; destiérralo hasta la próxima Standby Phase. 
Puedes mandar al Cementerio 1 monstruo ""HÉROE del Destino"" desde tu Deck; añade a tu mano 1 ""Prisión de la Torre del Reloj"" o ""Ciudad Prisión de la Torre del Reloj – Ciudad Oscura"" desde tu Deck o Cementerio. No puedes Invocar de Modo Especial por el resto de este turno, excepto monstruos ""HÉROE"" de OSCURIDAD. 
Sólo puedes usar cada uno de los efectos de ""HÉROE del Destino – Doom Liege"" una vez por turno.",Desterrar,Añadir a la mano,Desterrar hasta la próxima Standby Phase,,,,,,,,,,,,,
101306023,HÉROE del Destino – Dreadnought Servant,"Si controlas un monstruo ""HÉROE del Destino"" o una Mágica de Campo boca arriba: puedes Invocar esta carta de Modo Especial desde tu mano, y después puedes destruir 1 carta que controles y, si lo haces, añade a tu mano 1 ""Polimerización"" desde tu Deck. 
Si Invocas de Modo Especial uno o más monstruos ""HÉROE del Destino"" de Nivel 8: puedes desterrar esta carta en tu Cementerio, y después seleccionar 1 carta que controle tu adversario; ponla en la parte superior del Deck. 
Sólo puedes usar cada uno de los efectos de ""HÉROE del Destino – Dreadnought Servant"" una vez por turno.",Invocación Especial,Devolver al Deck,¿Destruir y añadir a la mano?,,,,,,,,,,,,,
101306036,Dragón Negro de Ojos Rojos Exceso,"""Dragón Negro de Ojos Rojos"" + 1 monstruo que mencione ""Mago del Tiempo Oscuro""	
Debe ser Invocado por Fusión, o Invocado de Modo Especial (desde el Deck Extra) Sacrificando 1 monstruo boca arriba de cualquier Campo el turno que destruiste un monstruo con el efecto de ""Mago del Tiempo Oscuro"". 
Si esta carta es Invocada de Modo Especial: puedes Invocar de Modo Especial 1 monstruo de Nivel 8 o menor desde tu mano o Cementerio. 
No es afectada por efectos de Mágicas y monstruos activados de tu adversario.",Invocación Especial,,,,,,,,,,,,,,,
101306037,HÉROE del Destino – Dreadnought,"2 monstruos ""HÉROE del Destino"" de Nivel 5 o mayor	
Debe ser Invocado por Fusión, o Invocado de Modo Especial (desde tu Deck Extra) Sacrificando 1 ""HÉROE del Destino - Dreadmaster"". 
Sólo puedes Invocar de Modo Especial ""HÉROE del Destino – Dreadnought"" una vez por turno de esta forma, sin importar el método que uses. 
Si esta carta es Invocada de Modo Especial: puedes añadir a tu mano 2 monstruos ""HÉROE del Destino"" y/o cartas que mencionen el nombre de un monstruo ""HÉROE del Destino"" desde tu Deck. 
El ATK de esta carta se convierte en el ATK original total de todos los demás monstruos ""HÉROE del Destino"" en tu Campo y Cementerio.",Añadir a la mano,,,,,,,,,,,,,,,
101306052,Mago del Tiempo Oscuro,"Activa 1 de estos efectos (pero sólo puedes activar cada efecto de ""Mago del Tiempo Oscuro"" una vez por turno);
● Añade a tu mano 1 carta que mencione ""Mago del Tiempo Oscuro"" desde tu Deck, excepto ""Mago del Tiempo Oscuro"", y además durante esta End Phase, añade a tu mano 1 carta en tu Cementerio que mencione ""Mago del Tiempo Oscuro"".
● Lanza una moneda y adivina cara o cruz. Si aciertas, destruye todos los monstruos que controle tu adversario y, si lo haces, inflige daño a tu adversario igual a la mitad de su ATK combinado. Si fallas, destruye todos los monstruos que controles.",Activar,Añadir a la mano,Lanzar una moneda,,,,,,,,,,,,,
101306053,Dados Grácil y del Cráneo,"Lanza un dado de seis caras dos veces y además aplica estos efectos este turno. 
● Tus monstruos que mencionen ""Mago del Tiempo Oscuro"" ganan ATK/DEF igual al resultado x 200.
● Los monstruos de tu adversario pierden ATK/DEF igual al resultado x 200.	
Si tu adversario Invoca de Modo Normal o Especial uno o más monstruos, mientras esta carta está en el Cementerio: puedes desterrar esta carta, y después seleccionar 1 de esos monstruos; lanza un dado de seis caras dos veces, y si el resultado total es 6 o mayor, destruye ese monstruo.",Activar,Tirar un dado,,,,,,,,,,,,,,
101306054,Scapegoats Soñolientas,"Invoca de Modo Especial 4 ""Ficha de Cordero de Sacrificio"" (Bestia/TIERRA/Nivel 1/ATK 0/DEF 0), y después si tu adversario controla un monstruo, puedes Invocar de Modo Especial 1 ""Guerrero Pantera Veloz"" desde tu Deck. Por el resto de este turno, esas Fichas no pueden ser Sacrificadas para una Invocación por Sacrificio, y además no puedes Invocar de Modo Especial desde el Deck Extra, excepto Monstruos de Fusión. 
Si una o más cartas que controlas que mencionen ""Mago del Tiempo Oscuro"" fueran a ser destruidas en batalla o por efecto de carta, puedes destruir 1 de esas Fichas que controles en su lugar.",Activar,Selecciona el número de Invocaciones Especiales,¿Invocar de Modo Especial {CARD}?,,,,,,,,,,,,,
101306062,Ciudad Prisión de la Torre del Reloj – Ciudad Oscura,"Cada vez que Invocas de Modo Especial uno o más monstruos ""HÉROE del Destino"" de Nivel 8 o mayor: todos los monstruos Guerrero que controles en este momento ganan 300 ATK. 
Sólo puedes usar cada uno de los siguientes efectos de ""Ciudad Prisión de la Torre del Reloj – Ciudad Oscura"" una vez por turno. 
Si esta carta fue activada este turno: puedes añadir a tu mano 1 monstruo ""HÉROE del Destino"", o 1 carta que mencione el nombre de un monstruo ""HÉROE del Destino"", desde tu Deck. 
Si esta carta es destruida: puedes Invocar de Modo Especial 1 monstruo ""HÉROE del Destino"" desde tu Deck (esto se trata como una Invocación Especial con ""Prisión de la Torre del Reloj"").",Añadir a la mano,Aumentar ATK,Invocación Especial,,,,,,,,,,,,,
101306070,Ladrón de Tumbas Insensato,"Manda al Cementerio 1 carta que mencione ""Mago del Tiempo Oscuro"" (excepto ""Ladrón de Tumbas Insensato"") desde tu Deck, y después puedes Invocar de Modo Especial 1 monstruo de cualquier Cementerio a tu Campo. 
Puedes desterrar esta carta en tu Cementerio; Coloca 1 de estas cartas en tu Campo:
● 1 Mágica/Trampa que mencione ""Mago del Tiempo Oscuro"" (excepto ""Ladrón de Tumbas Insensato"") desde tu Cementerio.
● 1 Mágica/Trampa del Cementerio de tu adversario.	
Sólo puedes usar cada uno de los efectos de ""Ladrón de Tumbas Insensato"" una vez por turno.",Enviar al Cementerio,Colocar,Invocación Especial?,,,,,,,,,,,,,
101306071,Caja de Reversión,"Durante la Standby Phase: lanza 1 dado y después pon contadores en esta carta igual al número obtenido (máx. 6). 
Una vez por turno, cuando se activa un efecto de monstruo en el Campo de tu adversario, o cuando un monstruo del adversario ataca, durante el cálculo de daño: puedes retirar 1 contador de esta carta y seleccionar 1 de esos monstruos del adversario; lanza una moneda y adivina cara o cruz. Si aciertas, Invoca de Modo Especial 1 monstruo que mencione ""Mago del Tiempo Oscuro"" desde tu Deck, y si lo haces, el ATK del monstruo seleccionado se convierte en 0 y sus efectos son negados hasta el final de este turno.",Colocar un contador,Lanzar una moneda,Selecciona el número de contadores a colocar,,,,,,,,,,,,,
101306154,Ficha de Cordero de Sacrificio,"Invocada de Modo Especial con el efecto de ""Scapegoats Soñolientas"".",,,,,,,,,,,,,,,,
101306254,Ficha de Cordero de Sacrificio,"Invocada de Modo Especial con el efecto de ""Scapegoats Soñolientas"".",,,,,,,,,,,,,,,,
101306354,Ficha de Cordero de Sacrificio,"Invocada de Modo Especial con el efecto de ""Scapegoats Soñolientas"".",,,,,,,,,,,,,,,,
101306454,Ficha de Cordero de Sacrificio,"Invocada de Modo Especial con el efecto de ""Scapegoats Soñolientas"".",,,,,,,,,,,,,,,,
