id,name,desc,str1,str2,str3,str4,str5,str6,str7,str8,str9,str10,str11,str12,str13,str14,str15,str16
100200290,Scène du Destin,"Vous pouvez activer cette carte le tour où elle a été Posée, en révélant 1 Monstre Normal dans votre main.
Invoquez Spécialement max. 5 Monstres Normaux depuis votre main et/ou Cimetière en Position d'Attaque, et aussi, vous ne pouvez pas Invoquer Spécialement depuis l'Extra Deck le reste de ce tour après la résolution de cette carte.
Vous ne pouvez activer qu'1 ""Scène du Destin"" par tour.",Activer,Activer en appliquant l'effet de {CARD}.,,,,,,,,,,,,,,
100200292,Elfe Pur-Sang,"Durant votre Main Phase : vous pouvez envoyer 1 Magie d'Équipement depuis votre Deck au Cimetière, puis cette carte gagne 500 ATK jusqu'à la fin du tour de votre adversaire.
Vous ne pouvez utiliser cet effet de ""Elfe Pur-Sang"" qu'une fois par tour.
Lorsque cette carte détruit un monstre de l'adversaire au combat : vous pouvez ajouter à votre main, ou Invoquer Spécialement, 1 monstre LUMIÈRE Magicien de max. Niveau 4 (""Elfe Pur-Sang"" exclu) depuis votre Deck.",Envoyer au Cimetière,Manipulation du Deck,,,,,,,,,,,,,,
100200293,Lion d'Assaut,"Vous pouvez Invoquer par Sacrifice cette carte face recto en Sacrifiant 1 monstre Bête-Guerrier.
Si cette carte combat un monstre, les dommages de combat qu'elle inflige à votre adversaire sont doublés.
Si un ou plusieurs monstres Bête-Guerrier sont Invoqués Normalement ou Spécialement sur votre Terrain tant que cette carte est dans votre Cimetière : vous pouvez ajouter cette carte à votre main, puis immédiatement après la résolution de cet effet, vous pouvez Invoquer par Sacrifice cette carte face recto, et si vous le faites, elle gagne 500 ATK, et aussi, bannissez-la lorsqu'elle quitte le Terrain.
Vous ne pouvez utiliser cet effet de ""Lion d'Assaut"" qu'une fois par tour.",Invocation Sacrifice en Sacrifiant 1 monstre Bête-Guerrier,Ajouter à la main,Invocation Sacrifice ?,,,,,,,,,,,,,
100200294,Connexion de Puissance,"Ciblez un nombre de votre choix de monstres face recto que vous contrôlez (si vous ciblez min. 2 monstres, ils doivent avoir le même Type) ; ils gagnent 500 ATK pour chaque monstre ciblé, jusqu'à la fin de ce tour.
Si vous avez activé ""Réincarnation d'Armement"" ce tour : vous pouvez ajouter cette carte depuis votre Cimetière à votre main.
Vous ne pouvez utiliser chaque effet de ""Connexion de Puissance"" qu'une fois par tour.",Activer,Recycler,,,,,,,,,,,,,,
100260001,"Chapeau, Troupe de Clowns","Échelle Pendule = 7
[ Effet Pendule ]
Durant votre Main Phase : vous pouvez envoyer 1 carte ""Troupe de Clowns"" (Monstres Pendule exclus) depuis votre Deck au Cimetière, et si vous le faites, Invoquez Spécialement cette carte, et aussi, vous ne pouvez pas activer les effets de monstres Invoqués Spécialement depuis le Deck ou Extra Deck jusqu'à la fin du prochain tour. Vous ne pouvez utiliser cet effet de ""Chapeau, Troupe de Clowns"" qu'une fois par tour.
----------------------------------------
[ Effet de Monstre ]
Les monstres contrôlés par votre adversaire perdent 1500 DEF tant que vous contrôlez un monstre Invoqué par Sacrifice. Si cette carte est Sacrifiée : vous pouvez activer 1 de ces effets (mais vous ne pouvez utiliser chacun de ces effets de ""Chapeau, Troupe de Clowns"" qu'une fois par tour) ;
● Mélangez tous les Monstres Pendule sur le Terrain et face recto dans les Extra Decks dans le Deck.
● Invoquez Spécialement 1 monstre ""Troupe de Clowns"" non-Pendule depuis votre Deck ou Extra Deck, en ignorant ses conditions d'Invocation.",Invocation Spéciale,Choisir un effet,Renvoyer au Deck,Invocation Spéciale,,,,,,,,,,,,
100261001,Lapin des Ténèbres Malin,"Après que cette carte est Invoquée Normalement ou Spécialement, vous pouvez Invoquer Normalement 1 monstre qui mentionne ""Monde des Toons"" durant votre Main Phase ce tour, en plus de votre Invocation/Pose Normale (vous ne pouvez gagner cet effet qu'une fois par tour).
Cette carte est traitée comme un monstre Toon tant que ""Monde des Toons"" est sur le Terrain.
Une fois par tour : vous pouvez ajouter à votre main, ou placer face recto sur votre Terrain, 1 Magie de Terrain ou Continue ""Toon"" depuis votre Deck.",,"Invoquer par l'effet de ""Lapin des Ténèbres Malin""",Effet d'ajout à la main,Placer,,,,,,,,,,,,
100261002,Chat Comique,"Cette carte est traitée comme un monstre Toon tant que ""Monde des Toons"" est sur le Terrain.
Durant la Main Phase (Effet Rapide) : vous pouvez Sacrifier 1 monstre (si vous contrôlez ""Monde des Toons"", vous pouvez Sacrifier 1 monstre contrôlé par votre adversaire, même si vous ne le contrôlez pas), et si vous le faites, Invoquez Spécialement 1 monstre qui mentionne ""Monde des Toons"" depuis votre main ou Deck, en ignorant ses conditions d'Invocation.
Vous ne pouvez utiliser cet effet de ""Chat Comique"" qu'une fois par tour.",,Invocation Spéciale,,,,,,,,,,,,,,
100261003,Boîte Maléfique,"Si vous contrôlez ""Monde des Toons"" : vous pouvez Invoquer Spécialement cette carte depuis votre main, puis vous pouvez ajouter à votre main ou Poser 1 Piège ""Toon"" depuis votre Deck.
Vous ne pouvez utiliser cet effet de ""Boîte Maléfique"" qu'une fois par tour.
Cette carte est traitée comme un monstre Toon tant que ""Monde des Toons"" est sur le Terrain.
Une fois par tour (Effet Rapide) : vous pouvez cibler 1 carte dans l'un des Cimetières ; placez-la au-dessous du Deck.",Invocation Spéciale,Récupérer depuis le Cimetière,Sélectionner une Carte Piège ?,,,,,,,,,,,,,
100261004,Mage Illusionniste Anonyme aux Yeux Noirs,"Vous pouvez défausser cette carte, puis activez 1 de ces effets (mais vous ne pouvez utiliser chacun de ces effets de ""Mage Illusionniste Anonyme aux Yeux Noirs"" qu'une fois par tour) ;
● Placez 1 ""Télépathie"" depuis votre main ou Deck face recto sur votre Terrain.
● Ajoutez 1 autre monstre qui mentionne ""Monde des Toons"" depuis votre Cimetière à votre main, puis vous pouvez l'Invoquer Spécialement, en ignorant ses conditions d'Invocation.
Si cette carte combat un monstre, aucun de ces 2 monstres ne peut être détruit par ce combat.",Défausser,Placer une Carte Piège,Récupérer un monstre,Invocation Spéciale?,,,,,,,,,,,,
100261005,Dragon Ultime Toon aux Yeux Bleus,"""Dragon Toon aux Yeux Bleus"" + 2 monstres Toon
Uniquement Invocable Spécialement (depuis votre Extra Deck) en mélangeant les cartes ci-dessus depuis votre main, Terrain et/ou Cimetière dans le Deck/Extra Deck.
Vos monstres Toon peuvent attaquer directement.
Une fois par tour : vous pouvez ajouter 1 carte ""Toon"", ou 1 carte qui mentionne un nom de carte ""Toon"", depuis votre Cimetière à votre main.
Durant le calcul des dommages, si votre monstre Toon est attaqué : vous pouvez le bannir jusqu'à la fin de la Damage Step.",,Recycler,Bannir,,,,,,,,,,,,,
100261006,Monde des Toons le Monde Parfait,"Le nom de cette carte devient ""Monde des Toons"" tant qu'elle est dans la Zone Terrain.
Une fois par tour : vous pouvez ajouter 1 carte ""Toon"", ou 1 carte qui mentionne un nom de carte ""Toon"", depuis votre Deck à votre main.
Vous ne pouvez utiliser cet effet de ""Monde des Toons le Monde Parfait"" que trois fois par tour.
Avant la résolution d'une autre carte ou effet activé, vous pouvez bannir 1 monstre Toon que vous contrôlez jusqu'à immédiatement après la résolution de la carte/effet, et aussi, vous ne pouvez pas bannir de monstres du même nom d'origine avec cet effet de ""Monde des Toons le Monde Parfait"" le reste de ce tour.",,Ajouter à la main,,Bannir le monstre ?,,,,,,,,,,,,
100261007,Télépathie,"Tant que vous avez une carte ""Toon"" dans votre Terrain ou Cimetière, votre adversaire doit garder sa main révélée, et aussi, vous pouvez regarder ses cartes Posées à tout moment.
Si vous avez un monstre Toon et une Magie ""Toon"" dans votre Terrain et/ou Cimetière : vous pouvez déclarer 1 nom de carte qui n'est pas parmi les cartes/effets activés dans cette Chaîne ; annulez les effets activés des cartes de ce nom d'origine jusqu'à la fin de ce tour, tant que cette carte est face recto sur le Terrain.
Vous ne pouvez utiliser cet effet de ""Télépathie"" qu'une fois par tour.",,Déclarer,,,,,,,,,,,,,,
100261023,"Terracottan, Artisanesorcière","Si cette carte est dans votre main : vous pouvez cibler 1 carte ""Artisanesorcière"" dans votre Cimetière (""Terracottan, Artisanesorcière"" exclue) ; ajoutez-la à votre main, et si vous le faites, Invoquez Spécialement cette carte, et aussi, vous ne pouvez pas Invoquer Spécialement (monstres ""Artisanesorcière"" exclus) depuis l'Extra Deck le reste de ce tour.
Durant votre Main Phase : vous pouvez Invoquer par Fusion 1 Monstre Fusion ""Artisanesorcière"" depuis votre Extra Deck, en utilisant des monstres depuis votre main ou Terrain.
Vous ne pouvez utiliser chaque effet de ""Terracottan, Artisanesorcière"" qu'une fois par tour.",Invocation Spéciale,Invocation Fusion,,,,,,,,,,,,,,
100261024,"Marka, Artisanesorcière","Vous pouvez Sacrifier cette carte depuis votre main ou Terrain ; ajoutez 1 Magie de Terrain ou Continue ""Artisanesorcière"" depuis votre Deck à votre main.
Si un ou plusieurs monstres ""Artisanesorcière"" face recto que vous contrôlez quittent le Terrain à cause d'un effet de carte de l'adversaire, tant que cette carte est dans votre Cimetière : vous pouvez Invoquer Spécialement cette carte (mais bannissez-la lorsqu'elle quitte le Terrain), et si vous le faites, Sacrifiez 1 monstre contrôlé par votre adversaire.
Vous ne pouvez utiliser chaque effet de ""Marka, Artisanesorcière"" qu'une fois par tour.",Ajouter à la main,Invocation Spéciale,,,,,,,,,,,,,,
100261025,"Madame Rilliona, Artisanesorcière","""Madame Verre, Artisanesorcière"" + 2 monstres Magicien
Si cette carte est Invoquée par Fusion : vous pouvez Invoquer Spécialement max. 3 monstres ""Artisanesorcière"" de max. Niveau 7 d'Attributs différents les uns des autres depuis votre main et/ou Deck, et aussi, vous ne pouvez pas Invoquer Spécialement (Monstres Fusion exclus) depuis l'Extra Deck le reste de ce tour.
Durant votre End Phase, si cette carte est dans votre Cimetière : vous pouvez révéler 1 Magie dans votre main ; Invoquez Spécialement cette carte en Position de Défense.
Vous ne pouvez utiliser chaque effet de ""Madame Rilliona, Artisanesorcière"" qu'une fois par tour.",Invoquer Spécialement depuis le Deck,Invoquer Spécialement cette carte,,,,,,,,,,,,,,
100261026,"Élèves, Artisanesorcière","1 monstre ""Artisanesorcière"" + 1 monstre Magicien
Durant la Main ou Battle Phase (Effet Rapide) : vous pouvez activer 1 de ces effets ;
● Ajoutez 1 Magie ""Artisanesorcière"" depuis votre Deck à votre main.
● Révélez 1 Magie Normale ou Jeu-Rapide ""Artisanesorcière"" dans votre main ; appliquez l'effet d'activation de la Magie.
Durant votre End Phase : vous pouvez renvoyer 1 de vos cartes ""Artisanesorcière"" bannies au Cimetière.
Vous ne pouvez utiliser chaque effet de ""Élèves, Artisanesorcière"" qu'une fois par tour.",Activer,Retourner au Cimetière,Effet d'ajout à la main,Copier l'effet,,,,,,,,,,,,
100261027,Célébration Artisanesorcière,"Activez 1 de ces effets ;
● Détruisez 1 monstre ""Artisanesorcière"" que vous contrôlez et 1 carte contrôlée par votre adversaire.
● Invoquez par Fusion 1 Monstre Fusion ""Artisanesorcière"" depuis votre Extra Deck, en mélangeant des monstres Magicien depuis votre Cimetière et/ou bannissement dans le Deck.
Durant votre End Phase, si vous contrôlez un monstre ""Artisanesorcière"", tant que cette carte est dans votre Cimetière : vous pouvez ajouter cette carte à votre main.
Vous ne pouvez utiliser qu'1 effet de ""Célébration Artisanesorcière"" par tour, et uniquement une fois le tour.",Activer,Ajouter à la main,Effet de destruction,Invocation Fusion,,,,,,,,,,,,
100261028,Walpurgis Artisanesorcière,"Durant votre Main Phase : vous pouvez ajouter 1 monstre ""Artisanesorcière"" depuis votre Deck à votre main, puis défaussez 1 carte.
Vous ne pouvez utiliser cet effet de ""Walpurgis Artisanesorcière"" qu'une fois par tour.
Durant votre tour, si vous allez défausser pour activer l'effet d'un monstre ""Artisanesorcière"" que vous contrôlez, vous pouvez envoyer 1 Magie/Piège ""Artisanesorcière"" (""Walpurgis Artisanesorcière"" exclue) depuis votre Deck au Cimetière à la place.",Ajouter à la main,,,,,,,,,,,,,,,
100261029,Distorsion Artisanesorcière,"Lorsqu'une Carte Magie/Piège ou un effet de monstre est activé et que vous contrôlez un monstre ""Artisanesorcière"" de min. Niveau 5 : annulez l'activation, et si vous le faites, détruisez la carte.
Si cette carte est dans votre Cimetière, sauf le tour où elle y a été envoyée : vous pouvez la bannir ; ajoutez 1 monstre Magicien de min. Niveau 5 depuis votre Deck à votre main, puis défaussez 1 carte.
Vous ne pouvez utiliser chaque effet de ""Distorsion Artisanesorcière"" qu'une fois par tour.",Activer,Ajouter à la main,,,,,,,,,,,,,,
100261047,Ogresses Désenchaînées - Shara,"Durant la Main Phase (Effet Rapide) : vous pouvez défausser cette carte ; Invoquez Spécialement 1 monstre Démon depuis votre main, puis détruisez 1 carte que vous contrôlez.
Si une ou plusieurs cartes sur le Terrain sont détruites par un effet de carte (celui de ""Ogresses Désenchaînées - Shara"" exclu), ou au combat, tant que cette carte est dans votre Cimetière : vous pouvez Invoquer Spécialement cette carte (mais placez-la au-dessous du Deck lorsqu'elle quitte le Terrain) ou l'ajouter à votre main.
Vous ne pouvez utiliser chaque effet de ""Ogresses Désenchaînées - Shara"" qu'une fois par tour.",Invocation Spéciale,Recycler,,,,,,,,,,,,,,
100261048,Ogresses Désenchaînées - Shma,"Si cette carte est Invoquée Normalement : vous pouvez Invoquer Spécialement 1 monstre ""Désenchaîné"" de max. Niveau 4 (""Ogresses Désenchaînées - Shma"" exclu) depuis votre Deck, puis détruisez 1 carte que vous contrôlez, et aussi, vous ne pouvez pas Invoquer Spécialement (monstres Démon exclus) le reste de ce tour.
Si cette carte sur le Terrain est détruite par un effet de carte (celui de ""Ogresses Désenchaînées - Shma"" exclu), ou au combat : vous pouvez Invoquer Spécialement 1 monstre ""Désenchaîné"" (""Ogresses Désenchaînées - Shma"" exclu) depuis votre main ou Deck.
Vous ne pouvez utiliser chaque effet de ""Ogresses Désenchaînées - Shma"" qu'une fois par tour.",Invoquer Spécialement depuis le Deck,Invoquer Spécialement depuis la main/le Deck,,,,,,,,,,,,,,
100261049,Magistrat Malveillant Désenchaîné de Kamura,"Vous pouvez cibler max. 3 cartes que vous contrôlez ; détruisez-les, et si vous le faites, Invoquez Spécialement cette carte depuis votre main, puis vous pouvez appliquer n'importe lequel des effets suivants, dans l'ordre, selon les types d'origine des cartes détruites.
● Monstre : Piochez 1 carte.
● Magie : Changez la position de combat d'1 monstre sur le Terrain.
● Piège : Détruisez 1 autre carte sur le Terrain.
Si cette carte sur le Terrain est détruite par un effet de carte : vous pouvez détruire tous les monstres sur le Terrain. Vous ne pouvez utiliser chaque effet de ""Magistrat Malveillant Désenchaîné de Kamura"" qu'une fois par tour.",Invocation Spéciale,Effet de destruction,Piocher 1 carte ?,Changer la position de combat ?,Détruire ?,,,,,,,,,,,
100261050,Enma Désenchaîné du Seigneur de Yama,"2+ monstres (un monstre ""Âme Désenchaînée"" inclus)
Durant votre End Phase : vous pouvez cibler max. 2 monstres Démon dans votre Cimetière qui ont été détruits et y ont été envoyés ce tour ; Invoquez-les Spécialement, mais vous ne pouvez pas Invoquer Spécialement (monstres Démon exclus) tant que vous contrôlez l'un des monstres face recto.
Si cette carte sur le Terrain va être détruite au combat ou par un effet de carte, vous pouvez détruire 1 carte face recto sur le Terrain à la place.
Vous ne pouvez utiliser chaque effet de ""Enma Désenchaîné du Seigneur de Yama"" qu'une fois par tour.",Invocation Spéciale,,Invoqué Spécialement par l'effet de {CARD},,,,,,,,,,,,,
100261051,Âme Désenchaînée de la Rage Abominateur,"2+ monstres (un monstre Démon inclus)
Si votre adversaire Invoque Spécialement un ou plusieurs monstres face recto : vous pouvez en cibler 1 ; détruisez 1 monstre Démon que vous contrôlez, et si vous le faites, annulez les effets du monstre ciblé jusqu'à la fin de ce tour.
Lorsqu'un effet de monstre est activé sur le Terrain et que vous contrôlez un Monstre Lien ""Désenchaîné"" de min. Link-4 (Effet Rapide) : vous pouvez bannir cette carte depuis votre Cimetière ; détruisez le monstre qui a activé l'effet.
Vous ne pouvez utiliser chaque effet de ""Âme Désenchaînée de la Rage Abominateur"" qu'une fois par tour.",Annuler,Détruire,,,,,,,,,,,,,,
100261052,Réincarnation des Désenchaînés,"Lorsque cette carte est activée : vous pouvez ajouter 1 Magie ""Désenchaîné"" (""Réincarnation du Désenchaîné"" exclue) ou 1 ""Prison de l'Abomination"" depuis votre Deck à votre main.
Une fois par tour : vous pouvez cibler max. 3 cartes ""Désenchaîné"" (""Réincarnation du Désenchaîné"" exclu) dans votre Cimetière ; mélangez-les dans le Deck, puis vous pouvez détruire un nombre d'autres cartes que vous contrôlez inférieur ou égal au nombre mélangé.
Vous ne pouvez activer qu'1 ""Réincarnation des Désenchaînés"" par tour.",Ajouter à la main?,Effet de récupération,Détruire la carte ?,,,,,,,,,,,,,
100261053,Syncrétisme Désenchaîné,"Ciblez 2 monstres face recto sur le Terrain (un Monstre Lien ""Âme Désenchaînée"" que vous contrôlez inclus) ; immédiatement après la résolution de cet effet, Invoquez par Lien 1 monstre Démon en utilisant uniquement les 2 monstres.
Si cette carte Posée est détruite par un effet de carte : vous pouvez Invoquer Spécialement 1 monstre ""Désenchaîné"" depuis votre Deck.
Vous ne pouvez utiliser chaque effet de ""Syncrétisme Désenchaîné"" qu'une fois par tour.",Invocation Lien,Invocation Spéciale,,,,,,,,,,,,,,
100263001,Tyrannosaure Noir,"Peut attaquer directement si tous les monstres contrôlés par votre adversaire sont en Position de Défense.
Vous ne pouvez utiliser chacun des effets suivants de ""Tyrannosaure Noir"" qu'une fois par tour.
Durant votre Main Phase, si une Carte Magie ou un effet de Magie a été activé ce tour : vous pouvez Invoquer Spécialement cette carte depuis votre main.
Si cette carte est envoyée au Cimetière : vous pouvez ajouter 1 monstre Dinosaure de min. Niveau 8 depuis votre Deck à votre main, puis vous pouvez l'Invoquer Spécialement si votre adversaire contrôle un monstre.",Invocation Spéciale,Ajouter à la main,Invocation Spéciale?,,,,,,,,,,,,,
100263002,Force Arcane XII - Le Pendu,"Lorsqu'une carte ou un effet est activé (Effet Rapide) : vous pouvez révéler cette carte dans votre main ; Invoquez Spécialement 1 monstre ""Force Arcane"" depuis votre main en Position de Défense.
Vous ne pouvez utiliser cet effet de ""Force Arcane XII - Le Pendu"" qu'une fois par tour.
Si cette carte est Invoquée : lancez une pièce.
● Face : détruisez 1 monstre que vous contrôlez, et si vous le faites, recevez des dommages égaux à son ATK d'origine.
● Pile : détruisez 1 monstre contrôlé par votre adversaire, et si vous le faites, infligez des dommages à votre adversaire égaux à son ATK d'origine.",Invocation Spéciale,Effet de lancer de pièce,,,,,,,,,,,,,,
100263003,"Candelato, le Monstre de Lumière","(Cette carte est toujours traitée comme carte ""Bête Fantôme"".)
Gagne 1000 ATK/DEF pour chaque carte dans votre main.
Vous ne pouvez utiliser chacun des effets suivants de ""Candelato, le Monstre de Lumière"" qu'une fois par tour.
Vous pouvez défausser 2 autres cartes ; Invoquez Spécialement cette carte depuis votre main, puis vous pouvez ajouter 1 carte depuis votre Deck à votre main qui a un effet de lancer de pièce.
Lorsqu'une carte ou un effet qui inclut un effet qui ajoute une ou plusieurs cartes depuis le Deck à la main est activé (Effet Rapide) : vous pouvez annuler l'effet.",Invocation Spéciale,Annuler,Ajouter à la main?,,,,,,,,,,,,,
100263004,"Eitom, le Guerrier Plasma","(Cette carte est toujours traitée comme carte ""Guerrier Magnétique"".)
Ni Invocable Normalement ni Posable Normalement.
Uniquement Invocable Spécialement (depuis votre main ou Cimetière) en Sacrifiant 1 monstre de min. Niveau 7.
Vous ne pouvez Invoquer Spécialement ""Eitom, le Guerrier Plasma"" qu'une fois par tour de cette façon.
Une fois par tour : vous pouvez envoyer 1 monstre ""Guerrier Magnétique"" (""Eitom, le Guerrier Plasma"" exclu) depuis votre Deck au Cimetière ; le reste de ce tour, l'ATK d'origine de cette carte devient 1500, et aussi, elle peut attaquer directement.",,Attaque directe,,,,,,,,,,,,,,
100263005,Seigneur Chevalier Blanc,"(Cette carte est toujours traitée comme carte ""Nuit Blanche"".)
Vous pouvez bannir 3 monstres de votre Cimetière ; Invoquez Spécialement cette carte depuis votre main, puis vous pouvez appliquer 1 de ces effets.
● Invoquez Spécialement 1 monstre ""Nuit Blanche"" depuis votre main ou Deck.
● Ajoutez 1 ""Voile Blanc"" depuis votre Deck à votre main.
Vous ne pouvez utiliser cet effet de ""Seigneur Chevalier Blanc"" qu'une fois par tour.
Lorsqu'une attaque impliquant cette carte et un monstre de l'adversaire est déclarée : changez l'ATK du monstre de l'adversaire à 0.
Si cette carte en possession de son propriétaire est détruite par une carte de l'adversaire : infligez 1000 points de dommages à votre adversaire.",Invocation Spéciale,L'ATK devient 0,Infliger des dommages,Ne pas résoudre l'effet,Invocation Spéciale,Ajouter à la main,,,,,,,,,,
100263006,Invincible Seigneur de l'Au-Delà,"Durant la End Phase, si un ou plusieurs monstres ont été détruits au combat ce tour : vous pouvez Invoquer Spécialement cette carte depuis votre main ou Cimetière, et si ""Invincible Seigneur de l'Au-Delà"" a été détruit au combat ce tour, l'ATK d'origine de cette carte devient 3000, et aussi, elle ne peut être détruite par des effets de carte.
Durant votre Main Phase : vous pouvez révéler un nombre de cartes (""Coup du Destin"" inclus) dans votre Deck, égal au nombre de cartes contrôlées par votre adversaire +1 et placez les cartes révélées au-dessus du Deck dans l'ordre de votre choix.
Vous ne pouvez utiliser chaque effet de ""Invincible Seigneur de l'Au-Delà"" qu'une fois par tour.",Invocation Spéciale,Placer au-dessus du Deck,Sélectionnez une carte à placer au-dessus du Deck.,,,,,,,,,,,,,
100263007,"Bloqueur Clay, HÉROS Élémentaire","1 monstre ""HÉROS Élémentaire"" + 1 monstre Guerrier
Si cette carte est Invoquée Spécialement : vous pouvez Invoquer Spécialement 1 monstre ""HÉROS Élémentaire"" depuis votre Deck, puis si votre adversaire contrôle une carte, vous pouvez infliger 400 points de dommages à votre adversaire pour chacune, et aussi, vous ne pouvez pas Invoquer Spécialement (monstres ""HÉROS"" exclus) depuis l'Extra Deck le reste de ce tour.
Vous ne pouvez utiliser cet effet de ""Bloqueur Clay, HÉROS Élémentaire"" qu'une fois par tour.
Les autres monstres ""HÉROS Élémentaire"" que vous contrôlez ne peuvent être détruits ni au combat ni par des effets de carte.",Invocation Spéciale,Infliger des dommages ?,,,,,,,,,,,,,,
100263008,Écrase-Poupée,"Ciblez 1 monstre que vous contrôlez ; détruisez-le, et si vous le faites, piochez 2 cartes, puis vous pouvez changer la position de combat d'1 monstre contrôlé par votre adversaire.
Si un ou plusieurs monstres sont Invoqués Spécialement depuis votre Cimetière tant que cette carte est dans votre Cimetière : vous pouvez ajouter cette carte à votre main.
Vous ne pouvez utiliser chaque effet de ""Écrase-Poupée"" qu'une fois par tour.",Activer,Recycler,Changer la position de combat ?,,,,,,,,,,,,,
100263009,Invocation Éclair,"Immédiatement après la résolution de cet effet, Invoquez/Poser Normalement 1 monstre.
Lorsque vous le faites, si votre adversaire contrôle un monstre, vous pouvez Invoquer Normalement un monstre de min. Niveau 5 sans Sacrifice.
Durant votre Main Phase, si cette carte est dans votre Cimetière, sauf le tour où elle y a été envoyée : vous pouvez la bannir ; ajoutez 1 monstre de min. Niveau 5 qui peut être Invoqué/Posé Normalement depuis votre Deck ou Cimetière à votre main, puis immédiatement après la résolution de cet effet, vous pouvez l'Invoquer par Sacrifice.
Vous ne pouvez utiliser cet effet de ""Invocation Éclair"" qu'une fois par tour.",Activer,Ajouter à la main,Appliquer l'effet de {CARD} pour Invoquer sans Sacrifice ?,,,,,,,,,,,,,
100263010,Explosion D,"Ciblez 1 Magie face recto que vous contrôlez ; détruisez-la, et si vous le faites, piochez 1 carte, puis si vous contrôlez un monstre ""HÉROS de la Destinée"", vous pouvez Invoquer Spécialement 1 monstre ""HÉROS de la Destinée"" depuis votre main, Cimetière ou bannissement.
À la fin de la Damage Step, si un monstre équipé avec une Carte d'Équipement, ou ""Dogma - HÉROS de la Destinée"", a attaqué : vous pouvez bannir cette carte depuis votre Cimetière ; le monstre peut faire une seconde attaque à la suite.
Vous ne pouvez activer qu'1 ""Explosion D"" par tour.",Piocher,Effectuer une attaque supplémentaire,Invocation Spéciale?,,,,,,,,,,,,,
